Topic,Sub-Category,Titles,Authors,Keywords,Abstract/Highlights,Frequency,Hapaxex,Images
Health Sciences,,Differential derived stimulus relations across probe-trial versus adduction testing are not a function of comparison-stimulus presentation - ScienceDirect,"['Adam H.', 'Doughty', 'Jenna A.', 'Soydan']","['adduction', 'derived stimulus relations', 'emergent learning', 'stimulus equivalence', 'human', 'mouse click']",Derived relational learning powerful There limited research effects assessment type derived relations Derived relations occur readily probe testing adduction testing The difference due role comparison stimuli per se The present research assessed whether unreliable derivation three node equivalence relations adduction testing due absence comparison stimulus presentation College students first learned arbitrary matching sample discriminations AB BC CD DE Arabic numbers A nonsense syllables B C D nonrepresentational forms E stimuli Participants exposed either probe trial testing adduction testing In probe trial testing trial involved one four E stimuli e g E1 sample four A stimuli A1 A2 A3 A4 comparisons Successful performance involved participants selecting corresponding A stimulus absence differential consequences e g A1 presence E1 In adduction testing trial involved arithmetic equation successful performance involved combining derived EA relations simple math skills Critically unlike typical adduction testing participants presented four response options select e comparison stimuli In probe trial testing participant derived EA relations whereas participant performed successfully adduction testing The present findings suggest unreliable derivation three node equivalence relations adduction testing due typical absence comparison stimuli The present research challenges experimental psychologists clarify role testing context identifying necessary sufficient conditions control emergent learning ,"[('testing', 12), ('adduction', 7), ('relations', 6), ('stimuli', 6), ('trial', 5), ('The', 4), ('involved', 4), ('probe', 4), ('comparison', 4), ('absence', 3), ('research', 3), ('A', 3), ('e', 3), ('due', 3), ('In', 3), ('derived', 3), ('four', 3), ('present', 3), ('equivalence', 2), ('stimulus', 2), ('derivation', 2), ('learning', 2), ('typical', 2), ('participant', 2), ('performance', 2), ('A1', 2), ('three', 2), ('sample', 2), ('E', 2), ('Derived', 2), ('g', 2), ('EA', 2), ('participants', 2), ('E1', 2), ('role', 2), ('unreliable', 2), ('node', 2), ('learned', 1), ('unlike', 1), ('corresponding', 1), ('matching', 1), ('consequences', 1), ('necessary', 1), ('whether', 1), ('A3', 1), ('skills', 1), ('select', 1), ('equation', 1), ('B', 1), ('presence', 1), ('arbitrary', 1), ('forms', 1), ('occur', 1), ('effects', 1), ('assessment', 1), ('experimental', 1), ('simple', 1), ('control', 1), ('difference', 1), ('suggest', 1), ('per', 1), ('A2', 1), ('powerful', 1), ('findings', 1), ('limited', 1), ('nonsense', 1), ('emergent', 1), ('selecting', 1), ('comparisons', 1), ('Critically', 1), ('identifying', 1), ('arithmetic', 1), ('context', 1), ('first', 1), ('math', 1), ('psychologists', 1), ('whereas', 1), ('Successful', 1), ('relational', 1), ('CD', 1), ('D', 1), ('either', 1), ('C', 1), ('DE', 1), ('one', 1), ('se', 1), ('College', 1), ('combining', 1), ('assessed', 1), ('numbers', 1), ('type', 1), ('sufficient', 1), ('There', 1), ('performed', 1), ('discriminations', 1), ('successfully', 1), ('exposed', 1), ('successful', 1), ('Participants', 1), ('presented', 1), ('differential', 1), ('conditions', 1), ('nonrepresentational', 1), ('options', 1), ('AB', 1), ('clarify', 1), ('presentation', 1), ('BC', 1), ('syllables', 1), ('students', 1), ('Arabic', 1), ('A4', 1), ('readily', 1), ('challenges', 1), ('response', 1), ('', 1)]","['learned', 'unlike', 'corresponding', 'matching', 'consequences', 'necessary', 'whether', 'A3', 'skills', 'select', 'equation', 'B', 'presence', 'arbitrary', 'forms', 'occur', 'effects', 'assessment', 'experimental', 'simple', 'control', 'difference', 'suggest', 'per', 'A2', 'powerful', 'findings', 'limited', 'nonsense', 'emergent', 'selecting', 'comparisons', 'Critically', 'identifying', 'arithmetic', 'context', 'first', 'math', 'psychologists', 'whereas', 'Successful', 'relational', 'CD', 'D', 'either', 'C', 'DE', 'one', 'se', 'College', 'combining', 'assessed', 'numbers', 'type', 'sufficient', 'There', 'performed', 'discriminations', 'successfully', 'exposed', 'successful', 'Participants', 'presented', 'differential', 'conditions', 'nonrepresentational', 'options', 'AB', 'clarify', 'presentation', 'BC', 'syllables', 'students', 'Arabic', 'A4', 'readily', 'challenges', 'response', '']","['https://sdfestaticassets-eu-west-1.sciencedirectassets.com/shared-assets/24/images/elsevier-non-solus-new-grey.svg', 'https://sdfestaticassets-us-east-1.sciencedirectassets.com/prod/e4b0060dfcc1e59ea745c796eec191584d117c0d/image/elsevier-non-solus.png', 'https://ars.els-cdn.com/content/image/S03766357.gif', 'https://sdfestaticassets-eu-west-1.sciencedirectassets.com/shared-assets/26/images/wordmark-elsevier.svg']"
Health Sciences,,Down syndrome associated moyamoya may worsen epilepsy control and can benefit from surgical revascularization - ScienceDirect,"['Sarah R.', 'Garson', 'Stephen J.', 'Monteith', 'Sheila D.', 'Smith', 'Bart P.', 'Keogh', 'Ryder P.', 'Gwinn', 'Michael J.', 'Doherty']","['Bypass', 'Perfusion', 'Stenosis']",Moyamoya blood flow compromises seen Down syndrome Both moyamoya Down syndrome associated Epilepsy If moyamoya related perfusion worsens seizure control We report bilateral indirect extracranial intracranial bypass surgeries Down syndrome patient moyamoya The surgeries markedly improved seizure control quality life To examine outcome bilateral extracranial intracranial EC IC bypass surgeries Down syndrome patient hard treat epilepsy moyamoya Superficial temporal arteries anastamosed using indirect bypass technique middle cerebral arteries bilaterally help limit perfusion deficits seizure controls Two superficial temporal middle cerebral artery indirect bypass surgeries performed within 3 months Post revascularization improvements included seizure control gait perfusion wakefulness language quality life In patients Down syndrome moyamoya improvements seizure control quality life may occur EC IC bypass procedures ,"[('bypass', 5), ('Down', 5), ('moyamoya', 5), ('syndrome', 5), ('seizure', 5), ('surgeries', 4), ('control', 4), ('life', 3), ('perfusion', 3), ('indirect', 3), ('quality', 3), ('improvements', 2), ('intracranial', 2), ('patient', 2), ('temporal', 2), ('arteries', 2), ('EC', 2), ('bilateral', 2), ('IC', 2), ('extracranial', 2), ('middle', 2), ('cerebral', 2), ('We', 1), ('markedly', 1), ('flow', 1), ('Superficial', 1), ('', 1), ('3', 1), ('performed', 1), ('occur', 1), ('help', 1), ('Epilepsy', 1), ('Post', 1), ('hard', 1), ('improved', 1), ('limit', 1), ('epilepsy', 1), ('examine', 1), ('months', 1), ('patients', 1), ('included', 1), ('blood', 1), ('controls', 1), ('treat', 1), ('technique', 1), ('If', 1), ('procedures', 1), ('gait', 1), ('artery', 1), ('bilaterally', 1), ('outcome', 1), ('within', 1), ('To', 1), ('Both', 1), ('may', 1), ('superficial', 1), ('In', 1), ('using', 1), ('Two', 1), ('revascularization', 1), ('worsens', 1), ('Moyamoya', 1), ('compromises', 1), ('anastamosed', 1), ('associated', 1), ('related', 1), ('deficits', 1), ('wakefulness', 1), ('language', 1), ('seen', 1), ('The', 1), ('report', 1)]","['We', 'markedly', 'flow', 'Superficial', '', '3', 'performed', 'occur', 'help', 'Epilepsy', 'Post', 'hard', 'improved', 'limit', 'epilepsy', 'examine', 'months', 'patients', 'included', 'blood', 'controls', 'treat', 'technique', 'If', 'procedures', 'gait', 'artery', 'bilaterally', 'outcome', 'within', 'To', 'Both', 'may', 'superficial', 'In', 'using', 'Two', 'revascularization', 'worsens', 'Moyamoya', 'compromises', 'anastamosed', 'associated', 'related', 'deficits', 'wakefulness', 'language', 'seen', 'The', 'report']","['https://sdfestaticassets-eu-west-1.sciencedirectassets.com/shared-assets/24/images/elsevier-non-solus-new-grey.svg', 'https://sdfestaticassets-us-east-1.sciencedirectassets.com/prod/afe12190ac710772112f0f86c7de648c102fd84f/image/elsevier-non-solus.png', 'https://ars.els-cdn.com/content/image/1-s2.0-S2213323218X00036-cov150h.gif', 'https://sdfestaticassets-eu-west-1.sciencedirectassets.com/shared-assets/26/images/wordmark-elsevier.svg']"
Health Sciences,,Endoscopic approach to benign biliary obstruction - ScienceDirect,"['Andrea', 'Tringali', 'Vincenzo', 'Bove', 'Guido', 'Costamagna']","['benign biliary strictures', 'ERCP', 'fully covered', 'plastic stent', 'self-expandable metal stent']",During past 30 years endoscopic approach benign biliary strictures BBS became preferred mini invasive treatment modality benign diseases Endoscopic plastic metallic stenting balloon dilation represent gold standard treatment BBS Side side insertion multiple plastic stents effective treatment option BBS following cholecystectomy liver transplantation This strategy low recurrence rate long term follow better results fully covered self expandable metal stents FC SEMS FC SEMS seems advantage higher stricture resolution rate patients BBS secondary chronic pancreatitis Dilation dominant biliary strictures patients primary sclerosing cholangitis lower rate infective complications stenting treatment Endoscopic retrograde cholangiopancreatography represents safe effective approach BBS high success rate especially cases managed multidisciplinary setting ,"[('BBS', 5), ('treatment', 4), ('rate', 4), ('effective', 2), ('approach', 2), ('Endoscopic', 2), ('SEMS', 2), ('stenting', 2), ('biliary', 2), ('stents', 2), ('benign', 2), ('patients', 2), ('strictures', 2), ('FC', 2), ('plastic', 2), ('higher', 1), ('dilation', 1), ('', 1), ('multiple', 1), ('low', 1), ('represent', 1), ('better', 1), ('standard', 1), ('cholangiopancreatography', 1), ('gold', 1), ('mini', 1), ('seems', 1), ('resolution', 1), ('results', 1), ('transplantation', 1), ('preferred', 1), ('metal', 1), ('success', 1), ('covered', 1), ('invasive', 1), ('cases', 1), ('option', 1), ('chronic', 1), ('During', 1), ('setting', 1), ('expandable', 1), ('following', 1), ('30', 1), ('metallic', 1), ('cholangitis', 1), ('retrograde', 1), ('stricture', 1), ('infective', 1), ('past', 1), ('lower', 1), ('fully', 1), ('Side', 1), ('especially', 1), ('diseases', 1), ('complications', 1), ('primary', 1), ('recurrence', 1), ('secondary', 1), ('years', 1), ('long', 1), ('endoscopic', 1), ('modality', 1), ('high', 1), ('balloon', 1), ('Dilation', 1), ('pancreatitis', 1), ('follow', 1), ('insertion', 1), ('sclerosing', 1), ('managed', 1), ('self', 1), ('multidisciplinary', 1), ('side', 1), ('advantage', 1), ('liver', 1), ('strategy', 1), ('safe', 1), ('became', 1), ('dominant', 1), ('represents', 1), ('cholecystectomy', 1), ('term', 1), ('This', 1)]","['higher', 'dilation', '', 'multiple', 'low', 'represent', 'better', 'standard', 'cholangiopancreatography', 'gold', 'mini', 'seems', 'resolution', 'results', 'transplantation', 'preferred', 'metal', 'success', 'covered', 'invasive', 'cases', 'option', 'chronic', 'During', 'setting', 'expandable', 'following', '30', 'metallic', 'cholangitis', 'retrograde', 'stricture', 'infective', 'past', 'lower', 'fully', 'Side', 'especially', 'diseases', 'complications', 'primary', 'recurrence', 'secondary', 'years', 'long', 'endoscopic', 'modality', 'high', 'balloon', 'Dilation', 'pancreatitis', 'follow', 'insertion', 'sclerosing', 'managed', 'self', 'multidisciplinary', 'side', 'advantage', 'liver', 'strategy', 'safe', 'became', 'dominant', 'represents', 'cholecystectomy', 'term', 'This']","['https://sdfestaticassets-eu-west-1.sciencedirectassets.com/shared-assets/24/images/elsevier-non-solus-new-grey.svg', 'https://sdfestaticassets-us-east-1.sciencedirectassets.com/prod/afe12190ac710772112f0f86c7de648c102fd84f/image/elsevier-non-solus.png', 'https://ars.els-cdn.com/content/image/1-s2.0-S2213179515X00022-cov150h.gif', 'https://sdfestaticassets-eu-west-1.sciencedirectassets.com/shared-assets/26/images/wordmark-elsevier.svg']"
Health Sciences,,Epilepsy phenotype in patients with Xp22.31 microduplication - ScienceDirect,"['Mario', 'Brinciotti', 'Francesca', 'Fioriello', 'Antonio', 'Mittica', 'Laura', 'Bernardini', 'Marina', 'Goldoni', 'Maria', 'Matricardi']","[None, 'Benign epilepsy with centrotemporal spikes', None, 'single nucleotide polymorphism microarray', None, 'intermittent light stimulation', None, 'pattern stimulation', 'Epilepsy', 'EEG abnormalities', 'Xp22.31 microduplication', 'Phenotype']",Developmental disorders commonly associated Xp22 31 microduplication Seizures may occur specific epileptic syndromes rare Xp22 31 microduplication may additive role epilepsy phenotype expression The clinical significance Xp22 31 microduplication still unclear We describe family mother two children Xp22 31 microduplication associated different forms epilepsy epileptiform EEG abnormalities The proband benign epilepsy centrotemporal spikes dysgraphia dyscalculia IQ 72 sister juvenile myoclonic epilepsy bilateral talipes anomalies The mother carrier microduplication asymptomatic The asymptomatic father possess microduplication These data contribute delineate phenotype associated Xp22 31 microduplication suggest potential pathogenic role epilepsy phenotype ,"[('microduplication', 7), ('31', 5), ('epilepsy', 5), ('Xp22', 5), ('The', 4), ('phenotype', 3), ('associated', 3), ('asymptomatic', 2), ('role', 2), ('mother', 2), ('may', 2), ('unclear', 1), ('proband', 1), ('suggest', 1), ('dyscalculia', 1), ('These', 1), ('juvenile', 1), ('possess', 1), ('two', 1), ('dysgraphia', 1), ('spikes', 1), ('talipes', 1), ('myoclonic', 1), ('Seizures', 1), ('carrier', 1), ('abnormalities', 1), ('describe', 1), ('different', 1), ('We', 1), ('significance', 1), ('epileptiform', 1), ('EEG', 1), ('occur', 1), ('centrotemporal', 1), ('sister', 1), ('syndromes', 1), ('rare', 1), ('potential', 1), ('anomalies', 1), ('still', 1), ('delineate', 1), ('pathogenic', 1), ('72', 1), ('clinical', 1), ('data', 1), ('specific', 1), ('benign', 1), ('expression', 1), ('disorders', 1), ('commonly', 1), ('family', 1), ('forms', 1), ('Developmental', 1), ('bilateral', 1), ('contribute', 1), ('IQ', 1), ('additive', 1), ('children', 1), ('epileptic', 1), ('father', 1), ('', 1)]","['unclear', 'proband', 'suggest', 'dyscalculia', 'These', 'juvenile', 'possess', 'two', 'dysgraphia', 'spikes', 'talipes', 'myoclonic', 'Seizures', 'carrier', 'abnormalities', 'describe', 'different', 'We', 'significance', 'epileptiform', 'EEG', 'occur', 'centrotemporal', 'sister', 'syndromes', 'rare', 'potential', 'anomalies', 'still', 'delineate', 'pathogenic', '72', 'clinical', 'data', 'specific', 'benign', 'expression', 'disorders', 'commonly', 'family', 'forms', 'Developmental', 'bilateral', 'contribute', 'IQ', 'additive', 'children', 'epileptic', 'father', '']","['https://sdfestaticassets-eu-west-1.sciencedirectassets.com/shared-assets/24/images/elsevier-non-solus-new-grey.svg', 'https://sdfestaticassets-us-east-1.sciencedirectassets.com/prod/afe12190ac710772112f0f86c7de648c102fd84f/image/elsevier-non-solus.png', 'https://ars.els-cdn.com/content/image/1-s2.0-S2213323218X00036-cov150h.gif', 'https://sdfestaticassets-eu-west-1.sciencedirectassets.com/shared-assets/26/images/wordmark-elsevier.svg']"
Health Sciences,,Anti-parasitic egg rejection by great reed warblers (Acrocephalus arundinaceus) tracks differences along an eggshesll color gradient - ScienceDirect,"['Mikus', 'Abolins-Abols', 'Daniel', 'Hanley', 'Csaba', 'Moskát', 'Tomáš', 'Grim', 'Mark E.', 'Hauber']","['brood parasitism', 'color', 'defense', 'JND', 'maculation', 'metareplication', 'perception']",Avian brood parasite hosts reject foreign eggs based color contrasts foreign eggs Traditional models assume hosts use absolute color contrasts reject foreign eggs Great reed warblers use directional color contrasts likely reject browner bluer eggs Directional color contrasts increasingly shown explain egg rejection diverse host species ,"[('contrasts', 4), ('color', 4), ('eggs', 4), ('foreign', 3), ('reject', 3), ('use', 2), ('hosts', 2), ('models', 1), ('egg', 1), ('based', 1), ('', 1), ('bluer', 1), ('likely', 1), ('explain', 1), ('reed', 1), ('brood', 1), ('rejection', 1), ('parasite', 1), ('species', 1), ('directional', 1), ('browner', 1), ('Directional', 1), ('assume', 1), ('diverse', 1), ('Great', 1), ('Avian', 1), ('Traditional', 1), ('absolute', 1), ('warblers', 1), ('shown', 1), ('host', 1), ('increasingly', 1)]","['models', 'egg', 'based', '', 'bluer', 'likely', 'explain', 'reed', 'brood', 'rejection', 'parasite', 'species', 'directional', 'browner', 'Directional', 'assume', 'diverse', 'Great', 'Avian', 'Traditional', 'absolute', 'warblers', 'shown', 'host', 'increasingly']","['https://sdfestaticassets-eu-west-1.sciencedirectassets.com/shared-assets/24/images/elsevier-non-solus-new-grey.svg', 'https://sdfestaticassets-us-east-1.sciencedirectassets.com/prod/e4b0060dfcc1e59ea745c796eec191584d117c0d/image/elsevier-non-solus.png', 'https://ars.els-cdn.com/content/image/S03766357.gif', 'https://sdfestaticassets-eu-west-1.sciencedirectassets.com/shared-assets/26/images/wordmark-elsevier.svg']"
Health Sciences,,Generation of human iPS cell-derived intestinal epithelial cell monolayers by CDX2 transduction - ScienceDirect,"['Kazuo', 'Takayama', 'Ryosuke', 'Negoro', 'Tomoki', 'Yamashita', 'Kanae', 'Kawai', 'Moe', 'Ichikawa', 'Takanori', 'Mori', 'Noriyuki', 'Nakatsu', 'Kazuo', 'Harada', 'Sumito', 'Ito', 'Hiroshi', 'Yamada', 'Yoshiyuki', 'Yamaura', 'Kazumasa', 'Hirata', 'Seiichi', 'Ishida', 'Hiroyuki', 'Mizuguchi']","['CYP3A4', 'intestinal first-pass effect', 'differentiation', 'adenovirus', None, 'fraction absorbed (intestinal absorption)', None, 'fraction passing the gut wall (intestinal first-pass effect)', None, 'human iPS cell-derived intestinal epithelial cells', None, 'human iPS cell-derived intestinal epithelial cell monolayers', None, 'intestine-specific homeobox', None, 'krueppel-like factor 5', None, 'Lucifer Yellow', None, 'midazolam', None, 'mouse embryonic fibroblasts', None, 'apparent permeability coefficient', None, 'peptide transporter 1', None, 'P-glycoprotein', None, 'rifampicin', None, 'reverse transcription-polymerase chain reaction', None, 'sucrose isomerase', None, 'solute carrier transporters', None, 'SRY-related high-mobility group (HMG) box 9', None, 'transepithelial electrical resistance', None, 'transcription factor', None, '1,25-dihydroxyvitamin D3', None, 'vector particles', None, 'zonula occludens-1']",To develop effective safe orally administered drug important predict intestinal absorption rate intestinal first pass effect drug drug interactions orally administered drugs However existing model comprehensively predict intestinal pharmacokinetics drug response orally administered drugs In study attempted generate homogenous functional intestinal epithelial cells human induced pluripotent stem iPS cells pharmaceutical research We generated almost homogenous Villin zonula occludens 1 ZO1 positive intestinal epithelial cells caudal related homeobox transcription factor 2 CDX2 transduction human iPS cell derived intestinal progenitor cells Taking results together succeeded generating human iPS IECM applied various intestinal pharmacokinetics drug response tests orally administered drugs ,"[('intestinal', 7), ('drug', 5), ('cells', 4), ('orally', 4), ('administered', 4), ('human', 3), ('iPS', 3), ('drugs', 3), ('predict', 2), ('response', 2), ('pharmacokinetics', 2), ('homogenous', 2), ('epithelial', 2), ('We', 1), ('generated', 1), ('functional', 1), ('comprehensively', 1), ('rate', 1), ('In', 1), ('occludens', 1), ('IECM', 1), ('transduction', 1), ('first', 1), ('effective', 1), ('existing', 1), ('pass', 1), ('interactions', 1), ('together', 1), ('effect', 1), ('derived', 1), ('Taking', 1), ('pharmaceutical', 1), ('research', 1), ('CDX2', 1), ('absorption', 1), ('study', 1), ('pluripotent', 1), ('', 1), ('progenitor', 1), ('stem', 1), ('transcription', 1), ('model', 1), ('various', 1), ('generate', 1), ('results', 1), ('important', 1), ('To', 1), ('However', 1), ('positive', 1), ('1', 1), ('zonula', 1), ('factor', 1), ('applied', 1), ('tests', 1), ('cell', 1), ('almost', 1), ('homeobox', 1), ('2', 1), ('related', 1), ('caudal', 1), ('develop', 1), ('induced', 1), ('generating', 1), ('ZO1', 1), ('succeeded', 1), ('Villin', 1), ('attempted', 1), ('safe', 1)]","['We', 'generated', 'functional', 'comprehensively', 'rate', 'In', 'occludens', 'IECM', 'transduction', 'first', 'effective', 'existing', 'pass', 'interactions', 'together', 'effect', 'derived', 'Taking', 'pharmaceutical', 'research', 'CDX2', 'absorption', 'study', 'pluripotent', '', 'progenitor', 'stem', 'transcription', 'model', 'various', 'generate', 'results', 'important', 'To', 'However', 'positive', '1', 'zonula', 'factor', 'applied', 'tests', 'cell', 'almost', 'homeobox', '2', 'related', 'caudal', 'develop', 'induced', 'generating', 'ZO1', 'succeeded', 'Villin', 'attempted', 'safe']","['https://sdfestaticassets-eu-west-1.sciencedirectassets.com/shared-assets/24/images/elsevier-non-solus-new-grey.svg', 'https://sdfestaticassets-us-east-1.sciencedirectassets.com/prod/afe12190ac710772112f0f86c7de648c102fd84f/image/elsevier-non-solus.png', 'https://ars.els-cdn.com/content/image/S2352345X.gif', 'https://sdfestaticassets-eu-west-1.sciencedirectassets.com/shared-assets/26/images/wordmark-elsevier.svg']"
Health Sciences,,Heterotopia or overlaying cortex: What about in-between? - ScienceDirect,"['Emilija', 'Cvetkovska', 'William Alves', 'Martins', 'Jorge', 'Gonzalez-Martinez', 'Ken', 'Taylor', 'Jian', 'Li', 'Olesya', 'Grinenko', 'John', 'Mosher', 'Richard', 'Leahy', 'Patrick', 'Chauvel', 'Dileep', 'Nair']","['Periventricular nodular heterotopia', 'Stereo-EEG', 'Epileptogenicity']",We provide comprehensive evaluation unilateral periventricular nodular heterotopia PNH Seizures arose PNH simultaneously involved micronodules white matter patient Laser ablation PNH adjacent white matter rendered patient seizure free Micronodules PNH cortex might part epileptogenic network Minimally invasive surgery able disrupt patient specific pathological circuitry We describe patient unilateral periventricular nodular heterotopia PNH drug resistant epilepsy whose SEEG revealed seizures arising PNH almost simultaneous involvement heterotopic neurons micronodules scattered within white matter subsequently overlying cortex Laser ablation heterotopic nodules adjacent white matter rendered patient seizure free This case elucidates micronodules scattered white matter heterotopic nodules overlying cortex might another contributor complex epileptogenicity heterotopia Detecting patient specific targets epileptic network heterotopia creates possibility disrupt pathological circuit minimally invasive procedures ,"[('PNH', 6), ('patient', 6), ('white', 5), ('matter', 5), ('heterotopia', 4), ('cortex', 3), ('heterotopic', 3), ('micronodules', 3), ('disrupt', 2), ('pathological', 2), ('nodules', 2), ('ablation', 2), ('unilateral', 2), ('overlying', 2), ('We', 2), ('adjacent', 2), ('Laser', 2), ('invasive', 2), ('free', 2), ('might', 2), ('scattered', 2), ('specific', 2), ('seizure', 2), ('network', 2), ('nodular', 2), ('periventricular', 2), ('rendered', 2), ('epileptogenic', 1), ('whose', 1), ('revealed', 1), ('describe', 1), ('procedures', 1), ('subsequently', 1), ('epilepsy', 1), ('surgery', 1), ('', 1), ('able', 1), ('circuit', 1), ('case', 1), ('targets', 1), ('simultaneously', 1), ('provide', 1), ('another', 1), ('involvement', 1), ('drug', 1), ('arising', 1), ('Seizures', 1), ('epileptic', 1), ('Micronodules', 1), ('complex', 1), ('part', 1), ('neurons', 1), ('epileptogenicity', 1), ('Detecting', 1), ('Minimally', 1), ('contributor', 1), ('resistant', 1), ('SEEG', 1), ('seizures', 1), ('almost', 1), ('comprehensive', 1), ('minimally', 1), ('involved', 1), ('creates', 1), ('circuitry', 1), ('evaluation', 1), ('arose', 1), ('possibility', 1), ('within', 1), ('elucidates', 1), ('simultaneous', 1), ('This', 1)]","['epileptogenic', 'whose', 'revealed', 'describe', 'procedures', 'subsequently', 'epilepsy', 'surgery', '', 'able', 'circuit', 'case', 'targets', 'simultaneously', 'provide', 'another', 'involvement', 'drug', 'arising', 'Seizures', 'epileptic', 'Micronodules', 'complex', 'part', 'neurons', 'epileptogenicity', 'Detecting', 'Minimally', 'contributor', 'resistant', 'SEEG', 'seizures', 'almost', 'comprehensive', 'minimally', 'involved', 'creates', 'circuitry', 'evaluation', 'arose', 'possibility', 'within', 'elucidates', 'simultaneous', 'This']","['https://sdfestaticassets-eu-west-1.sciencedirectassets.com/shared-assets/24/images/elsevier-non-solus-new-grey.svg', 'https://sdfestaticassets-us-east-1.sciencedirectassets.com/prod/afe12190ac710772112f0f86c7de648c102fd84f/image/elsevier-non-solus.png', 'https://ars.els-cdn.com/content/image/1-s2.0-S2213323218X00036-cov150h.gif', 'https://sdfestaticassets-eu-west-1.sciencedirectassets.com/shared-assets/26/images/wordmark-elsevier.svg']"
