Topic,Sub-Category,Titles,Authors,Keywords,Abstract/Highlights,Frequency,Hapaxex,Images
Health Sciences,,Comparison of fentanyl and butorphanol for postoperative pain relief with intravenous patient controlled analgesia - ScienceDirect,"['Bhoomika', 'Thakore', 'Jacqueline', 'D’Mello', 'Shalini', 'Saksena', 'Manju', 'Butani']","['Postoperative pain', 'Fentanyl', 'Butorphanol', 'PCA']",Opioids effective postoperative analgesics influencing emotional aspects pain well reducing actual pain threshold Fentanyl phenylpiperidine derivative potent opioid agonist already studied postoperative analgesia Butorphanol synthetic morphinan derivative agonist antagonist studies substantiate use The present study undertaken compare effects two drugs postoperative pain relief terms efficacy safety A prospective randomized controlled study 100 patients ASA I II undergoing total abdominal hysterectomies conducted Group F 50 patients received fentanyl 0 4 μg kg h group B received butorphanol 4 μg kg h postoperative pain treatment via intravenous patient controlled analgesia v PCA Parameters monitored pain score VAS pulse blood pressure respiratory rate sedation score side effects The infusion rate number boluses PCA demands requirement rescue analgesia noted Both drugs equally effective safe postoperative analgesics v PCA The dose 4 μg kg h butorphanol appeared effective dosage fentanyl used 0 4 μg kg h effective evidenced increased number boluses taken patients needs increased ,"[('pain', 5), ('postoperative', 5), ('μg', 4), ('effective', 4), ('4', 4), ('kg', 4), ('h', 4), ('analgesia', 3), ('The', 3), ('patients', 3), ('PCA', 3), ('boluses', 2), ('rate', 2), ('received', 2), ('study', 2), ('v', 2), ('controlled', 2), ('drugs', 2), ('derivative', 2), ('analgesics', 2), ('fentanyl', 2), ('score', 2), ('increased', 2), ('butorphanol', 2), ('number', 2), ('effects', 2), ('agonist', 2), ('0', 2), ('studies', 1), ('VAS', 1), ('compare', 1), ('group', 1), ('pressure', 1), ('phenylpiperidine', 1), ('potent', 1), ('randomized', 1), ('respiratory', 1), ('opioid', 1), ('morphinan', 1), ('antagonist', 1), ('', 1), ('appeared', 1), ('used', 1), ('evidenced', 1), ('abdominal', 1), ('terms', 1), ('pulse', 1), ('two', 1), ('synthetic', 1), ('patient', 1), ('threshold', 1), ('F', 1), ('substantiate', 1), ('Opioids', 1), ('treatment', 1), ('conducted', 1), ('requirement', 1), ('emotional', 1), ('demands', 1), ('use', 1), ('Both', 1), ('infusion', 1), ('aspects', 1), ('dose', 1), ('taken', 1), ('100', 1), ('total', 1), ('noted', 1), ('studied', 1), ('influencing', 1), ('efficacy', 1), ('reducing', 1), ('B', 1), ('A', 1), ('Butorphanol', 1), ('sedation', 1), ('II', 1), ('equally', 1), ('Fentanyl', 1), ('Parameters', 1), ('safe', 1), ('ASA', 1), ('Group', 1), ('via', 1), ('dosage', 1), ('safety', 1), ('prospective', 1), ('already', 1), ('needs', 1), ('relief', 1), ('intravenous', 1), ('blood', 1), ('well', 1), ('present', 1), ('rescue', 1), ('monitored', 1), ('I', 1), ('side', 1), ('hysterectomies', 1), ('actual', 1), ('50', 1), ('undertaken', 1), ('undergoing', 1)]","['studies', 'VAS', 'compare', 'group', 'pressure', 'phenylpiperidine', 'potent', 'randomized', 'respiratory', 'opioid', 'morphinan', 'antagonist', '', 'appeared', 'used', 'evidenced', 'abdominal', 'terms', 'pulse', 'two', 'synthetic', 'patient', 'threshold', 'F', 'substantiate', 'Opioids', 'treatment', 'conducted', 'requirement', 'emotional', 'demands', 'use', 'Both', 'infusion', 'aspects', 'dose', 'taken', '100', 'total', 'noted', 'studied', 'influencing', 'efficacy', 'reducing', 'B', 'A', 'Butorphanol', 'sedation', 'II', 'equally', 'Fentanyl', 'Parameters', 'safe', 'ASA', 'Group', 'via', 'dosage', 'safety', 'prospective', 'already', 'needs', 'relief', 'intravenous', 'blood', 'well', 'present', 'rescue', 'monitored', 'I', 'side', 'hysterectomies', 'actual', '50', 'undertaken', 'undergoing']","['https://sdfestaticassets-eu-west-1.sciencedirectassets.com/shared-assets/24/images/elsevier-non-solus-new-grey.svg', 'https://sdfestaticassets-us-east-1.sciencedirectassets.com/prod/28f7974af6f6f13c799a04c30c77072a7446ba94/image/elsevier-non-solus.png', 'https://ars.els-cdn.com/content/image/1-s2.0-S1366007109X00045-cov150h.gif', 'https://sdfestaticassets-eu-west-1.sciencedirectassets.com/shared-assets/26/images/wordmark-elsevier.svg']"
Health Sciences,,Contralateral limb movement modulates cold pressor pain - ScienceDirect,"['Eric E.', 'Brodie', 'Fiona M.A.', 'Kane', 'Karel', 'Gijsbers', 'Catherine A.', 'Niven']","['Pain', 'Movement', 'Cold pressor test']",Many studies investigating attenuation pain psychological means confounded cognitive factors motoric factors Two experiments performed investigate extent intentional movements alone attenuate experimental pain In experiment 1 tolerance intensity cold pressor pain administered non dominant hand measured two movement conditions reciprocal eye movements reciprocal finger movements dominant hand In experiment 2 tolerance intensity measured two reciprocal finger movement conditions visual attention directed dominant hand visual attention directed location noxiously stimulated non dominant hand Reciprocal finger movements limb contralateral noxiously stimulated limb found result significantly longer tolerance times significantly lower pain intensity ratings visual attention directed away spatial location noxious stimulation These results confirm movement limb contralateral noxiously stimulated limb attenuates experimental pain Further research required ascertain whether movement alone attenuates non experimental pain ,"[('pain', 6), ('dominant', 4), ('movement', 4), ('movements', 4), ('hand', 4), ('limb', 4), ('noxiously', 3), ('non', 3), ('experimental', 3), ('stimulated', 3), ('finger', 3), ('visual', 3), ('tolerance', 3), ('attention', 3), ('intensity', 3), ('directed', 3), ('reciprocal', 3), ('two', 2), ('conditions', 2), ('factors', 2), ('measured', 2), ('significantly', 2), ('contralateral', 2), ('attenuates', 2), ('alone', 2), ('location', 2), ('experiment', 2), ('In', 2), ('ratings', 1), ('', 1), ('results', 1), ('whether', 1), ('spatial', 1), ('administered', 1), ('noxious', 1), ('Further', 1), ('attenuate', 1), ('longer', 1), ('These', 1), ('experiments', 1), ('research', 1), ('psychological', 1), ('Two', 1), ('ascertain', 1), ('Many', 1), ('means', 1), ('confirm', 1), ('times', 1), ('performed', 1), ('lower', 1), ('extent', 1), ('cold', 1), ('1', 1), ('found', 1), ('studies', 1), ('pressor', 1), ('stimulation', 1), ('eye', 1), ('cognitive', 1), ('intentional', 1), ('motoric', 1), ('Reciprocal', 1), ('investigate', 1), ('away', 1), ('confounded', 1), ('required', 1), ('2', 1), ('result', 1), ('attenuation', 1), ('investigating', 1)]","['ratings', '', 'results', 'whether', 'spatial', 'administered', 'noxious', 'Further', 'attenuate', 'longer', 'These', 'experiments', 'research', 'psychological', 'Two', 'ascertain', 'Many', 'means', 'confirm', 'times', 'performed', 'lower', 'extent', 'cold', '1', 'found', 'studies', 'pressor', 'stimulation', 'eye', 'cognitive', 'intentional', 'motoric', 'Reciprocal', 'investigate', 'away', 'confounded', 'required', '2', 'result', 'attenuation', 'investigating']","['https://sdfestaticassets-eu-west-1.sciencedirectassets.com/shared-assets/24/images/elsevier-non-solus-new-grey.svg', 'https://sdfestaticassets-us-east-1.sciencedirectassets.com/prod/28f7974af6f6f13c799a04c30c77072a7446ba94/image/elsevier-non-solus.png', 'https://ars.els-cdn.com/content/image/1-s2.0-S1366007109X00045-cov150h.gif', 'https://sdfestaticassets-eu-west-1.sciencedirectassets.com/shared-assets/26/images/wordmark-elsevier.svg']"
Health Sciences,,Developing an Education Budget for Radiology Vice Chairs and Leaders: An ADVICER Template - ScienceDirect,"['Nancy R.', 'Fefferman', 'Sheryl G.', 'Jordan', 'Priscilla J.', 'Slanetz', 'Desiree E.', 'Morgan', 'Leonie L.', 'Gordon', 'Robert D.', 'Suh', 'Mark E.', 'Mullins']","['Budget', 'Faculty professional development', 'Financial accounting', 'Medical student education', 'Resident education', None, 'American Board of Radiology', None, 'Accreditation Council for Graduate Medical Education', None, 'Alliance of Directors and Vice Chairs in Education', None, 'Association of University Radiologists', None, 'graduate medical education', None, 'relative value unit', None, 'undergraduate medical education']",The Alliance Directors Vice Chairs Education group identified need develop education budget template resource community Having framework working knowledge budgetary considerations crucial general oversight executive managerial responsibility departmental educational programs An online survey sent Alliance Directors Vice Chairs Education members Survey questions included education funding sources presence vice chair finance expectation revenue generation existing education budget funding decision makers education budget formulation approval vice chair education role budget education budget line items income statement review The survey response rate 41 81 51 A majority 26 41 63 respondents education budget typically included funding medical students residents fellows minority respondents report developed 10 22 45 approved 6 22 27 regularly reviewed 6 21 29 budget In sharp contrast role department chairs administrators presumably participated process To assist education budget development review well meet need improve participants financial accounting knowledge key tenet faculty professional development authors developed sample budget templates income statement primer Our survey results suggested need educational budget framework financial accounting resources radiology education posts resources provided ,"[('budget', 10), ('education', 9), ('survey', 3), ('need', 3), ('funding', 3), ('Education', 2), ('financial', 2), ('accounting', 2), ('Vice', 2), ('income', 2), ('Chairs', 2), ('review', 2), ('41', 2), ('vice', 2), ('resources', 2), ('framework', 2), ('development', 2), ('The', 2), ('knowledge', 2), ('chair', 2), ('statement', 2), ('Alliance', 2), ('6', 2), ('educational', 2), ('role', 2), ('22', 2), ('Directors', 2), ('included', 2), ('respondents', 2), ('developed', 2), ('process', 1), ('questions', 1), ('An', 1), ('sent', 1), ('primer', 1), ('To', 1), ('Our', 1), ('programs', 1), ('regularly', 1), ('posts', 1), ('department', 1), ('63', 1), ('meet', 1), ('tenet', 1), ('decision', 1), ('', 1), ('suggested', 1), ('majority', 1), ('well', 1), ('45', 1), ('improve', 1), ('revenue', 1), ('presence', 1), ('generation', 1), ('sample', 1), ('develop', 1), ('authors', 1), ('resource', 1), ('group', 1), ('oversight', 1), ('reviewed', 1), ('minority', 1), ('budgetary', 1), ('expectation', 1), ('fellows', 1), ('students', 1), ('executive', 1), ('27', 1), ('templates', 1), ('A', 1), ('21', 1), ('26', 1), ('81', 1), ('report', 1), ('sharp', 1), ('response', 1), ('managerial', 1), ('chairs', 1), ('approved', 1), ('general', 1), ('crucial', 1), ('faculty', 1), ('medical', 1), ('online', 1), ('sources', 1), ('community', 1), ('approval', 1), ('Having', 1), ('10', 1), ('key', 1), ('members', 1), ('typically', 1), ('finance', 1), ('presumably', 1), ('makers', 1), ('departmental', 1), ('considerations', 1), ('contrast', 1), ('administrators', 1), ('participated', 1), ('professional', 1), ('29', 1), ('line', 1), ('items', 1), ('assist', 1), ('Survey', 1), ('provided', 1), ('existing', 1), ('In', 1), ('radiology', 1), ('identified', 1), ('results', 1), ('formulation', 1), ('rate', 1), ('responsibility', 1), ('residents', 1), ('template', 1), ('51', 1), ('participants', 1), ('working', 1)]","['process', 'questions', 'An', 'sent', 'primer', 'To', 'Our', 'programs', 'regularly', 'posts', 'department', '63', 'meet', 'tenet', 'decision', '', 'suggested', 'majority', 'well', '45', 'improve', 'revenue', 'presence', 'generation', 'sample', 'develop', 'authors', 'resource', 'group', 'oversight', 'reviewed', 'minority', 'budgetary', 'expectation', 'fellows', 'students', 'executive', '27', 'templates', 'A', '21', '26', '81', 'report', 'sharp', 'response', 'managerial', 'chairs', 'approved', 'general', 'crucial', 'faculty', 'medical', 'online', 'sources', 'community', 'approval', 'Having', '10', 'key', 'members', 'typically', 'finance', 'presumably', 'makers', 'departmental', 'considerations', 'contrast', 'administrators', 'participated', 'professional', '29', 'line', 'items', 'assist', 'Survey', 'provided', 'existing', 'In', 'radiology', 'identified', 'results', 'formulation', 'rate', 'responsibility', 'residents', 'template', '51', 'participants', 'working']","['https://sdfestaticassets-eu-west-1.sciencedirectassets.com/shared-assets/24/images/elsevier-non-solus-new-grey.svg', 'https://sdfestaticassets-us-east-1.sciencedirectassets.com/prod/28f7974af6f6f13c799a04c30c77072a7446ba94/image/elsevier-non-solus.png', 'https://ars.els-cdn.com/content/image/S10766332.gif', 'https://sdfestaticassets-eu-west-1.sciencedirectassets.com/shared-assets/26/images/wordmark-elsevier.svg']"
Health Sciences,,Effects of cognitive pain coping strategies and locus of control on perception of cold pressor pain in healthy individuals: Experimental study - ScienceDirect,"['Natasa', 'Jokic-Begic', 'Dragutin', 'Ivanec', 'Dragana', 'Markanovic']","['Internal–external control', 'Pain measurement', 'Experimental', 'Students', 'Time perception']",The aim present study determine effectiveness coping strategies distraction redefining pain experience individuals internal vs external locus control The participants exposed pain induced cold pressor procedure Pain tolerance pain intensity objective subjective duration pain measured three different situations In control situation participants use cognitive pain coping strategy In two situations used distraction redefining strategies respectively Internally externally oriented participants differ pain tolerance pain intensity ratings subjective duration painful stimulation three situations The use cognitive pain coping strategies increased pain tolerance groups comparison control situation In situations participants underestimated duration pain tolerance There difference effectiveness distraction redefining strategies pain tolerance pain intensity ratings Cognitive pain coping strategies increase duration pain tolerance irrespective individual locus control effect pain intensity rating ,"[('pain', 15), ('tolerance', 6), ('strategies', 5), ('duration', 4), ('control', 4), ('situations', 4), ('intensity', 4), ('participants', 4), ('coping', 4), ('In', 3), ('redefining', 3), ('The', 3), ('distraction', 3), ('subjective', 2), ('ratings', 2), ('cognitive', 2), ('use', 2), ('three', 2), ('situation', 2), ('effectiveness', 2), ('locus', 2), ('experience', 1), ('objective', 1), ('underestimated', 1), ('There', 1), ('rating', 1), ('oriented', 1), ('vs', 1), ('irrespective', 1), ('painful', 1), ('internal', 1), ('differ', 1), ('difference', 1), ('study', 1), ('', 1), ('groups', 1), ('effect', 1), ('procedure', 1), ('individuals', 1), ('respectively', 1), ('measured', 1), ('exposed', 1), ('used', 1), ('Pain', 1), ('increased', 1), ('Internally', 1), ('comparison', 1), ('cold', 1), ('determine', 1), ('two', 1), ('present', 1), ('pressor', 1), ('aim', 1), ('stimulation', 1), ('external', 1), ('externally', 1), ('Cognitive', 1), ('strategy', 1), ('induced', 1), ('individual', 1), ('increase', 1), ('different', 1)]","['experience', 'objective', 'underestimated', 'There', 'rating', 'oriented', 'vs', 'irrespective', 'painful', 'internal', 'differ', 'difference', 'study', '', 'groups', 'effect', 'procedure', 'individuals', 'respectively', 'measured', 'exposed', 'used', 'Pain', 'increased', 'Internally', 'comparison', 'cold', 'determine', 'two', 'present', 'pressor', 'aim', 'stimulation', 'external', 'externally', 'Cognitive', 'strategy', 'induced', 'individual', 'increase', 'different']","['https://sdfestaticassets-eu-west-1.sciencedirectassets.com/shared-assets/24/images/elsevier-non-solus-new-grey.svg', 'https://sdfestaticassets-us-east-1.sciencedirectassets.com/prod/28f7974af6f6f13c799a04c30c77072a7446ba94/image/elsevier-non-solus.png', 'https://ars.els-cdn.com/content/image/1-s2.0-S1366007109X00045-cov150h.gif', 'https://sdfestaticassets-eu-west-1.sciencedirectassets.com/shared-assets/26/images/wordmark-elsevier.svg']"
Health Sciences,,"Electrical punctual stimulation (P-STIM) with ear acupuncture following tonsillectomy, a randomised, controlled pilot study - ScienceDirect","['H.', 'Kager', 'R.', 'Likar', 'H.', 'Jabarzadeh', 'R.', 'Sittl', 'C.', 'Breschan', 'J.', 'Szeles']","['P-STIM', 'Ear acupuncture', 'Tonsillectomy', 'Postoperative', 'Pain score']",We examined whether P STIM administered pre postoperatively tonsillectomies resulted lower consumption analgesics improvement pain scores compared sham acupuncture This study carried randomised double blind controlled fashion Thirty three patients randomised 2 groups All patients P STIM applied beginning 30 min preoperatively The stimulation applied following 96 h The P STIM Verum group received sub threshold stimulation No stimulation applied P STIM Placebo group Premedication anaesthesia applied standardised fashion The efficacy P STIM application evaluated postoperatively using numeric visual analogue scales rest exertion measuring postoperative analgesic consumption At almost measured time points median pain score less P STIM Verum group P STIM Placebo group The VAS scores rest exertion also significantly less P STIM Verum group certain time points Analgesic consumption P STIM Verum group also less P STIM Placebo group however difference reach statistical significance We able demonstrate study P STIM applied pre postoperatively following tonsillectomies simple method seems effective side effects ,"[('P', 11), ('STIM', 11), ('group', 7), ('applied', 5), ('Verum', 4), ('The', 4), ('less', 3), ('Placebo', 3), ('consumption', 3), ('stimulation', 3), ('postoperatively', 3), ('pain', 2), ('rest', 2), ('points', 2), ('exertion', 2), ('also', 2), ('fashion', 2), ('pre', 2), ('We', 2), ('following', 2), ('tonsillectomies', 2), ('time', 2), ('patients', 2), ('study', 2), ('scores', 2), ('randomised', 2), ('anaesthesia', 1), ('sub', 1), ('whether', 1), ('', 1), ('however', 1), ('received', 1), ('demonstrate', 1), ('improvement', 1), ('application', 1), ('administered', 1), ('30', 1), ('analgesic', 1), ('Premedication', 1), ('96', 1), ('Analgesic', 1), ('threshold', 1), ('able', 1), ('double', 1), ('No', 1), ('groups', 1), ('measured', 1), ('significance', 1), ('sham', 1), ('reach', 1), ('measuring', 1), ('effects', 1), ('visual', 1), ('compared', 1), ('significantly', 1), ('carried', 1), ('lower', 1), ('scales', 1), ('difference', 1), ('method', 1), ('standardised', 1), ('side', 1), ('h', 1), ('evaluated', 1), ('efficacy', 1), ('examined', 1), ('controlled', 1), ('numeric', 1), ('blind', 1), ('preoperatively', 1), ('All', 1), ('effective', 1), ('using', 1), ('analgesics', 1), ('acupuncture', 1), ('score', 1), ('analogue', 1), ('At', 1), ('postoperative', 1), ('beginning', 1), ('Thirty', 1), ('min', 1), ('seems', 1), ('three', 1), ('almost', 1), ('simple', 1), ('resulted', 1), ('median', 1), ('statistical', 1), ('VAS', 1), ('2', 1), ('certain', 1), ('This', 1)]","['anaesthesia', 'sub', 'whether', '', 'however', 'received', 'demonstrate', 'improvement', 'application', 'administered', '30', 'analgesic', 'Premedication', '96', 'Analgesic', 'threshold', 'able', 'double', 'No', 'groups', 'measured', 'significance', 'sham', 'reach', 'measuring', 'effects', 'visual', 'compared', 'significantly', 'carried', 'lower', 'scales', 'difference', 'method', 'standardised', 'side', 'h', 'evaluated', 'efficacy', 'examined', 'controlled', 'numeric', 'blind', 'preoperatively', 'All', 'effective', 'using', 'analgesics', 'acupuncture', 'score', 'analogue', 'At', 'postoperative', 'beginning', 'Thirty', 'min', 'seems', 'three', 'almost', 'simple', 'resulted', 'median', 'statistical', 'VAS', '2', 'certain', 'This']","['https://sdfestaticassets-eu-west-1.sciencedirectassets.com/shared-assets/24/images/elsevier-non-solus-new-grey.svg', 'https://sdfestaticassets-us-east-1.sciencedirectassets.com/prod/28f7974af6f6f13c799a04c30c77072a7446ba94/image/elsevier-non-solus.png', 'https://ars.els-cdn.com/content/image/1-s2.0-S1366007109X00045-cov150h.gif', 'https://sdfestaticassets-eu-west-1.sciencedirectassets.com/shared-assets/26/images/wordmark-elsevier.svg']"
Health Sciences,,Exposure to extremely low frequency magnetic fields among working women and homemakers - ScienceDirect,"['Allison L', 'McCurdy', 'Louis', 'Wijnberg', 'Dana', 'Loomis', 'David', 'Savitz', 'Leena A', 'Nylander-French']","['magnetic field', 'exposure variability', 'mixed-effects multiple linear regression model', 'women', 'breast cancer']",Given concerns potential health effects exposure magnetic fields goal study examine magnitude sources occupational residential exposure extremely low frequency primarily 60 Hz magnetic fields among women Exposure 60 Hz magnetic fields surveyed among cases controls recruited study breast cancer 25 counties North Carolina The 273 women participated wore integrating personal magnetic field exposure meter AMEX 3 D measured time weighted average TWA exposure A questionnaire administered determine duration frequency electric appliance machinery use The geometric mean GM TWA exposure employed women 0 138 μT range 0 022 3 636 μT homemakers 0 113 μT range 0 022 0 403 μT Women working manufacturing industrial facilities highest exposure GM 0 265 μT range 0 054 3 436 μT nurses health technicians GM 0 134 μT range 0 032 0 285 μT teachers school administrators GM 0 099 μT range 0 035 0 673 μT lowest exposures Job titles unless limited scope environment self reported information equipment use potential exposure sources time distance good predictors magnetic field exposure Furthermore results show occupations previously observed increased risk breast cancer teachers nurses administrative support housewives elevated average magnetic field exposures Therefore questionable whether exposure power frequency magnetic fields cause increased breast cancer risk seen occupations ,"[('0', 13), ('μT', 10), ('exposure', 9), ('magnetic', 7), ('range', 5), ('GM', 4), ('fields', 4), ('3', 3), ('breast', 3), ('field', 3), ('women', 3), ('cancer', 3), ('frequency', 3), ('teachers', 2), ('average', 2), ('use', 2), ('risk', 2), ('60', 2), ('exposures', 2), ('Hz', 2), ('TWA', 2), ('022', 2), ('health', 2), ('time', 2), ('potential', 2), ('increased', 2), ('sources', 2), ('among', 2), ('nurses', 2), ('The', 2), ('study', 2), ('occupations', 2), ('cases', 1), ('controls', 1), ('environment', 1), ('285', 1), ('wore', 1), ('highest', 1), ('Exposure', 1), ('AMEX', 1), ('265', 1), ('housewives', 1), ('effects', 1), ('magnitude', 1), ('Given', 1), ('participated', 1), ('integrating', 1), ('previously', 1), ('', 1), ('low', 1), ('school', 1), ('geometric', 1), ('good', 1), ('reported', 1), ('unless', 1), ('cause', 1), ('limited', 1), ('lowest', 1), ('032', 1), ('personal', 1), ('Furthermore', 1), ('Job', 1), ('recruited', 1), ('facilities', 1), ('questionable', 1), ('Carolina', 1), ('whether', 1), ('273', 1), ('weighted', 1), ('636', 1), ('scope', 1), ('673', 1), ('measured', 1), ('25', 1), ('goal', 1), ('403', 1), ('administrative', 1), ('Women', 1), ('134', 1), ('predictors', 1), ('show', 1), ('primarily', 1), ('support', 1), ('counties', 1), ('099', 1), ('residential', 1), ('duration', 1), ('questionnaire', 1), ('Therefore', 1), ('elevated', 1), ('technicians', 1), ('138', 1), ('A', 1), ('examine', 1), ('distance', 1), ('extremely', 1), ('machinery', 1), ('concerns', 1), ('surveyed', 1), ('436', 1), ('meter', 1), ('homemakers', 1), ('035', 1), ('equipment', 1), ('seen', 1), ('administrators', 1), ('self', 1), ('administered', 1), ('D', 1), ('054', 1), ('information', 1), ('observed', 1), ('electric', 1), ('113', 1), ('appliance', 1), ('titles', 1), ('mean', 1), ('power', 1), ('results', 1), ('industrial', 1), ('manufacturing', 1), ('North', 1), ('employed', 1), ('occupational', 1), ('determine', 1), ('working', 1)]","['cases', 'controls', 'environment', '285', 'wore', 'highest', 'Exposure', 'AMEX', '265', 'housewives', 'effects', 'magnitude', 'Given', 'participated', 'integrating', 'previously', '', 'low', 'school', 'geometric', 'good', 'reported', 'unless', 'cause', 'limited', 'lowest', '032', 'personal', 'Furthermore', 'Job', 'recruited', 'facilities', 'questionable', 'Carolina', 'whether', '273', 'weighted', '636', 'scope', '673', 'measured', '25', 'goal', '403', 'administrative', 'Women', '134', 'predictors', 'show', 'primarily', 'support', 'counties', '099', 'residential', 'duration', 'questionnaire', 'Therefore', 'elevated', 'technicians', '138', 'A', 'examine', 'distance', 'extremely', 'machinery', 'concerns', 'surveyed', '436', 'meter', 'homemakers', '035', 'equipment', 'seen', 'administrators', 'self', 'administered', 'D', '054', 'information', 'observed', 'electric', '113', 'appliance', 'titles', 'mean', 'power', 'results', 'industrial', 'manufacturing', 'North', 'employed', 'occupational', 'determine', 'working']","['https://sdfestaticassets-eu-west-1.sciencedirectassets.com/shared-assets/24/images/elsevier-non-solus-new-grey.svg', 'https://sdfestaticassets-us-east-1.sciencedirectassets.com/prod/28f7974af6f6f13c799a04c30c77072a7446ba94/image/elsevier-non-solus.png', 'https://ars.els-cdn.com/content/image/S00034878.gif', 'https://sdfestaticassets-eu-west-1.sciencedirectassets.com/shared-assets/26/images/wordmark-elsevier.svg']"
