Topic,Sub-Category,Titles,Authors,Keywords,Abstract/Highlights,Frequency,Hapaxex,Images
Health Sciences,,Detection of cow mounting behavior using region geometry and optical flow characteristics - ScienceDirect,"['Yangyang', 'Guo', 'Ziru', 'Zhang', 'Dongjian', 'He', 'Jinyu', 'Niu', 'Yi', 'Tan']","['Dairy cows', 'Mounting behavior', 'Image region detection', 'Geometric feature', 'Optical flow feature']",Mounting behavior typical behavior cows estrus Background Subtraction Color Texture Features BSCTF proposed detect cows Geometric optical flow characteristics cows regions obtained These characteristics used identify mounting behavior cows Provided effective reference detecting cows estrus Computer vision technology may improve accuracy robustness estrus detection dairy cows In study proposed method detecting mounting behavior dairy cattle using geometric optical flow characteristics identified image regions videos taken dairy farms Videos captured farm often complex background interfere target detection In study used masking technology remove unrelated background converted RGB color space HSV color space adjusted summation coefficients HSV channels improve contrast cows background images Subsequently proposed Background Subtraction Color Texture Features BSCTF algorithm used detect cow regions Then perform inter frame differential processing detection regions geometric optical flow characteristics regions extracted seven optimized features used construct regional feature vectors Finally support vector machine SVM classifier trained classify detected regions mounting regions non mounting regions allowed identification mounting behavior We obtained accuracy omission rates detection method 98 3 6 4 respectively The average recognition accuracy false positive rates SVM classifier 90 9 4 2 respectively These results demonstrate proposed method effective detecting mounting behavior dairy cows convenient judging whether cows estrus ,"[('cows', 9), ('regions', 8), ('behavior', 6), ('mounting', 6), ('detection', 4), ('proposed', 4), ('used', 4), ('dairy', 4), ('characteristics', 4), ('estrus', 4), ('detecting', 3), ('background', 3), ('flow', 3), ('optical', 3), ('accuracy', 3), ('method', 3), ('classifier', 2), ('BSCTF', 2), ('detect', 2), ('study', 2), ('geometric', 2), ('space', 2), ('These', 2), ('HSV', 2), ('Color', 2), ('SVM', 2), ('Texture', 2), ('respectively', 2), ('In', 2), ('Features', 2), ('technology', 2), ('Background', 2), ('color', 2), ('obtained', 2), ('improve', 2), ('effective', 2), ('4', 2), ('Subtraction', 2), ('rates', 2), ('Computer', 1), ('average', 1), ('Videos', 1), ('6', 1), ('videos', 1), ('remove', 1), ('false', 1), ('inter', 1), ('unrelated', 1), ('construct', 1), ('identified', 1), ('differential', 1), ('cow', 1), ('cattle', 1), ('algorithm', 1), ('captured', 1), ('extracted', 1), ('processing', 1), ('trained', 1), ('whether', 1), ('farms', 1), ('machine', 1), ('classify', 1), ('2', 1), ('taken', 1), ('We', 1), ('features', 1), ('RGB', 1), ('Then', 1), ('The', 1), ('images', 1), ('allowed', 1), ('vectors', 1), ('often', 1), ('perform', 1), ('Provided', 1), ('adjusted', 1), ('demonstrate', 1), ('Finally', 1), ('vector', 1), ('feature', 1), ('image', 1), ('Geometric', 1), ('90', 1), ('judging', 1), ('coefficients', 1), ('identify', 1), ('optimized', 1), ('identification', 1), ('support', 1), ('using', 1), ('interfere', 1), ('regional', 1), ('non', 1), ('vision', 1), ('convenient', 1), ('9', 1), ('reference', 1), ('results', 1), ('may', 1), ('recognition', 1), ('frame', 1), ('seven', 1), ('robustness', 1), ('98', 1), ('target', 1), ('positive', 1), ('contrast', 1), ('channels', 1), ('omission', 1), ('3', 1), ('typical', 1), ('masking', 1), ('Subsequently', 1), ('farm', 1), ('complex', 1), ('summation', 1), ('Mounting', 1), ('converted', 1), ('detected', 1), ('', 1)]","['Computer', 'average', 'Videos', '6', 'videos', 'remove', 'false', 'inter', 'unrelated', 'construct', 'identified', 'differential', 'cow', 'cattle', 'algorithm', 'captured', 'extracted', 'processing', 'trained', 'whether', 'farms', 'machine', 'classify', '2', 'taken', 'We', 'features', 'RGB', 'Then', 'The', 'images', 'allowed', 'vectors', 'often', 'perform', 'Provided', 'adjusted', 'demonstrate', 'Finally', 'vector', 'feature', 'image', 'Geometric', '90', 'judging', 'coefficients', 'identify', 'optimized', 'identification', 'support', 'using', 'interfere', 'regional', 'non', 'vision', 'convenient', '9', 'reference', 'results', 'may', 'recognition', 'frame', 'seven', 'robustness', '98', 'target', 'positive', 'contrast', 'channels', 'omission', '3', 'typical', 'masking', 'Subsequently', 'farm', 'complex', 'summation', 'Mounting', 'converted', 'detected', '']","['https://sdfestaticassets-eu-west-1.sciencedirectassets.com/shared-assets/24/images/elsevier-non-solus-new-grey.svg', 'https://sdfestaticassets-us-east-1.sciencedirectassets.com/prod/74c6099c36819bfc8606dd144f68dd107c82feb0/image/elsevier-non-solus.png', 'https://ars.els-cdn.com/content/image/S01681699.gif', 'https://sdfestaticassets-eu-west-1.sciencedirectassets.com/shared-assets/26/images/wordmark-elsevier.svg']"
Health Sciences,,Diagnosis of myocardial infarction and prognostic utility of high-sensitivity troponin T after isolated aortic valve replacement - ScienceDirect,"['Tom K.M.', 'Wang', 'Ralph A.H.', 'Stewart', 'Tharumenthiran', 'Ramanathan', 'David', 'Choi', 'Greg', 'Gamble', 'Peter N.', 'Ruygrok', 'Harvey D.', 'White']","['Aortic valve replacement', 'High-sensitivity troponin', 'Myocardial infarction', 'Coronary artery bypass grafting', 'Mortality']",The Universal Definition type 5 myocardial infarction MI applies coronary artery bypass grafting CABG MIs cardiac surgery specifically defined We assessed whether elevated high sensitivity troponin hs TnT electrocardiogram ECG changes new wall motion abnormalities echocardiography defined Universal Definition predicted mortality morbidity aortic valve replacement AVR n 219 Consecutive patients isolated AVR performed July 2010 December 2012 followed 2 3 0 8 years Hs TnT measured 12 24 h post operatively ECG echocardiographic changes hs TnT 140 ng L 10 times 99th percentile upper reference limit 500 ng L 10 times coefficient variation 10 4th generation troponin T applied hs TnT pre specified criteria MI diagnosis There 9 1 20 3 7 8 patients ECG echocardiographic changes hs TnT 140 ng L hs TnT 500 ng L respectively Neither criterion independently associated 30 day mortality 2 7 Hs TnT 500 ng L ECG echocardiographic changes independently associated mortality 5 5 follow hazards ratio 5 23 95 confidence interval 1 09 25 2 p 0 039 Hs TnT per 100 ng L continuous parameter independently associated 30 day mortality mortality follow composite morbidity The Universal Definition MI using 10 times URL 4th generation troponin T 35 times URL hs TnT cutpoint 500 ng L ECG echocardiographic changes independently predicted median term mortality AVR Hs TnT continuous parameter independently associated mortality time points morbidity ,"[('TnT', 10), ('mortality', 7), ('ng', 7), ('L', 7), ('hs', 6), ('independently', 5), ('ECG', 5), ('changes', 5), ('echocardiographic', 4), ('10', 4), ('500', 4), ('5', 4), ('Hs', 4), ('associated', 4), ('times', 4), ('2', 3), ('troponin', 3), ('AVR', 3), ('Universal', 3), ('Definition', 3), ('MI', 3), ('morbidity', 3), ('0', 2), ('30', 2), ('140', 2), ('The', 2), ('predicted', 2), ('defined', 2), ('3', 2), ('4th', 2), ('generation', 2), ('8', 2), ('7', 2), ('follow', 2), ('T', 2), ('1', 2), ('continuous', 2), ('parameter', 2), ('patients', 2), ('URL', 2), ('day', 2), ('12', 1), ('respectively', 1), ('post', 1), ('applied', 1), ('interval', 1), ('25', 1), ('reference', 1), ('09', 1), ('years', 1), ('limit', 1), ('variation', 1), ('term', 1), ('criterion', 1), ('isolated', 1), ('20', 1), ('per', 1), ('2010', 1), ('23', 1), ('35', 1), ('bypass', 1), ('MIs', 1), ('aortic', 1), ('We', 1), ('median', 1), ('pre', 1), ('electrocardiogram', 1), ('whether', 1), ('specifically', 1), ('new', 1), ('219', 1), ('Neither', 1), ('n', 1), ('time', 1), ('points', 1), ('infarction', 1), ('sensitivity', 1), ('composite', 1), ('2012', 1), ('Consecutive', 1), ('replacement', 1), ('grafting', 1), ('There', 1), ('p', 1), ('high', 1), ('valve', 1), ('elevated', 1), ('criteria', 1), ('using', 1), ('December', 1), ('h', 1), ('July', 1), ('coronary', 1), ('confidence', 1), ('cutpoint', 1), ('performed', 1), ('motion', 1), ('9', 1), ('myocardial', 1), ('100', 1), ('diagnosis', 1), ('applies', 1), ('specified', 1), ('coefficient', 1), ('measured', 1), ('percentile', 1), ('24', 1), ('upper', 1), ('operatively', 1), ('95', 1), ('ratio', 1), ('abnormalities', 1), ('followed', 1), ('artery', 1), ('assessed', 1), ('CABG', 1), ('type', 1), ('99th', 1), ('wall', 1), ('echocardiography', 1), ('039', 1), ('hazards', 1), ('cardiac', 1), ('surgery', 1), ('', 1)]","['12', 'respectively', 'post', 'applied', 'interval', '25', 'reference', '09', 'years', 'limit', 'variation', 'term', 'criterion', 'isolated', '20', 'per', '2010', '23', '35', 'bypass', 'MIs', 'aortic', 'We', 'median', 'pre', 'electrocardiogram', 'whether', 'specifically', 'new', '219', 'Neither', 'n', 'time', 'points', 'infarction', 'sensitivity', 'composite', '2012', 'Consecutive', 'replacement', 'grafting', 'There', 'p', 'high', 'valve', 'elevated', 'criteria', 'using', 'December', 'h', 'July', 'coronary', 'confidence', 'cutpoint', 'performed', 'motion', '9', 'myocardial', '100', 'diagnosis', 'applies', 'specified', 'coefficient', 'measured', 'percentile', '24', 'upper', 'operatively', '95', 'ratio', 'abnormalities', 'followed', 'artery', 'assessed', 'CABG', 'type', '99th', 'wall', 'echocardiography', '039', 'hazards', 'cardiac', 'surgery', '']","['https://sdfestaticassets-eu-west-1.sciencedirectassets.com/shared-assets/24/images/elsevier-non-solus-new-grey.svg', 'https://sdfestaticassets-us-east-1.sciencedirectassets.com/prod/74c6099c36819bfc8606dd144f68dd107c82feb0/image/elsevier-non-solus.png', 'https://ars.els-cdn.com/content/image/1-s2.0-S2405587516X00042-cov150h.gif', 'https://sdfestaticassets-eu-west-1.sciencedirectassets.com/shared-assets/26/images/wordmark-elsevier.svg']"
Health Sciences,,Dynamic evaluation of airflow stream generated by a reverse system of an axial fan sprayer using 3D-ultrasonic anemometers. Effect of canopy structure - ScienceDirect,"['Ramón', 'Salcedo', 'Pau', 'Pons', 'Jordi', 'Llop', 'Tomás', 'Zaragoza', 'Javier', 'Campos', 'Paula', 'Ortega', 'Montserrat', 'Gallart', 'Emilio', 'Gil']","['Air assisted sprayers', 'Outlet plane', 'Artificial vineyard', 'Static and dynamic assays', 'Velocity profile']",The air generated pesticide treatments axial fan sprayers studied Air environmental problem formation atmospheric spray drift The air sprayer static dynamic position characterized The movement sprayer reinforced asymmetric behaviour fan Vegetation influence trajectories air currents atmosphere ,"[('The', 3), ('air', 3), ('sprayer', 2), ('fan', 2), ('studied', 1), ('Vegetation', 1), ('currents', 1), ('dynamic', 1), ('treatments', 1), ('movement', 1), ('sprayers', 1), ('formation', 1), ('drift', 1), ('generated', 1), ('', 1), ('trajectories', 1), ('influence', 1), ('asymmetric', 1), ('atmospheric', 1), ('static', 1), ('spray', 1), ('axial', 1), ('atmosphere', 1), ('position', 1), ('characterized', 1), ('behaviour', 1), ('problem', 1), ('pesticide', 1), ('Air', 1), ('environmental', 1), ('reinforced', 1)]","['studied', 'Vegetation', 'currents', 'dynamic', 'treatments', 'movement', 'sprayers', 'formation', 'drift', 'generated', '', 'trajectories', 'influence', 'asymmetric', 'atmospheric', 'static', 'spray', 'axial', 'atmosphere', 'position', 'characterized', 'behaviour', 'problem', 'pesticide', 'Air', 'environmental', 'reinforced']","['https://sdfestaticassets-eu-west-1.sciencedirectassets.com/shared-assets/24/images/elsevier-non-solus-new-grey.svg', 'https://sdfestaticassets-us-east-1.sciencedirectassets.com/prod/74c6099c36819bfc8606dd144f68dd107c82feb0/image/elsevier-non-solus.png', 'https://ars.els-cdn.com/content/image/S01681699.gif', 'https://sdfestaticassets-eu-west-1.sciencedirectassets.com/shared-assets/26/images/wordmark-elsevier.svg']"
Health Sciences,,Evaluation and prediction of nitrogen use efficiency and outputs in faeces and urine in beef cattle - ScienceDirect,"['A.', 'Angelidis', 'L.', 'Crompton', 'T.', 'Misselbrook', 'T.', 'Yan', 'C.K.', 'Reynolds', 'S.', 'Stergiadis']","['Nitrogen', 'Efficiency', 'Beef', 'Urine', 'Faeces', 'Prediction', 'Validation']",289 intakes outputs data used predict nitrogen N output efficiency Existing models underestimated N output animals consuming N rich diets New models including nutrient energy contents digestibility accurate More digestible diets metabolisable energy improve N use efficiency Increasing dry matter digestibility 100 g kg may reduce manure N output 4 8 g Beef cattle production valuable food security contributing meat high nutritional value However beef cattle rather inefficient utilising dietary nitrogen N thus excreting substantial amounts N urine faeces imposing environmental burden The aim study evaluate main dietary factors affecting N use efficiency NUE beef cattle develop prediction models N excretion manure faeces urine This knowledge essential development evaluation cost effective N mitigation strategies A database 289 treatment means constructed 69 published studies 1194 animals Data included diet contents N dry matter DM organic matter OM neutral detergent fibre NDF acid detergent fibre ADF ether extract starch ash gross energy GE metabolisable energy ME outputs N manure MNO urine UNO faeces FNO Regression equations predict MNO UNO FNO well various NUE indicators developed using residual maximum likelihood analysis Evaluation new existing models performed using mean prediction error MPE describe prediction accuracy MNO UNO FNO predicted improved accuracy MPE 0 557 0 162 0 764 0 208 0 458 0 177 respectively DM OM digestibilities diet contents N NDF ADF Starch OM GE ME forage proportion diet added predictors different equations already containing either DM intake N intake body weight primary predictor New existing models displayed prediction N outputs highest range actual N outputs MNO 207 g UNO 109 g However new equations improved overall accuracy best MPE MNO UNO FNO 0 162 0 208 0 177 respectively DM digestibility contents N NDF Starch ME added predictors different equations extent prediction also reduced occurring MNO 208 g UNO 132 g The regression models NUE demonstrated diets digestible contain less N fibre ME may reduce N excretions mitigation strategies also need account potential effect animal productivity health ,"[('N', 19), ('0', 9), ('models', 6), ('UNO', 6), ('MNO', 6), ('g', 6), ('prediction', 5), ('equations', 4), ('ME', 4), ('contents', 4), ('DM', 4), ('FNO', 4), ('energy', 4), ('outputs', 4), ('diet', 3), ('cattle', 3), ('faeces', 3), ('OM', 3), ('output', 3), ('fibre', 3), ('urine', 3), ('MPE', 3), ('manure', 3), ('digestibility', 3), ('208', 3), ('NDF', 3), ('matter', 3), ('efficiency', 3), ('diets', 3), ('NUE', 3), ('accuracy', 3), ('162', 2), ('nitrogen', 2), ('ADF', 2), ('existing', 2), ('289', 2), ('intake', 2), ('added', 2), ('New', 2), ('may', 2), ('strategies', 2), ('dry', 2), ('reduce', 2), ('GE', 2), ('digestible', 2), ('use', 2), ('predictors', 2), ('improved', 2), ('mitigation', 2), ('animals', 2), ('The', 2), ('respectively', 2), ('177', 2), ('dietary', 2), ('beef', 2), ('detergent', 2), ('also', 2), ('metabolisable', 2), ('different', 2), ('Starch', 2), ('using', 2), ('predict', 2), ('However', 2), ('new', 2), ('value', 1), ('ash', 1), ('More', 1), ('likelihood', 1), ('body', 1), ('including', 1), ('organic', 1), ('Existing', 1), ('forage', 1), ('utilising', 1), ('predictor', 1), ('means', 1), ('valuable', 1), ('thus', 1), ('evaluation', 1), ('A', 1), ('data', 1), ('69', 1), ('occurring', 1), ('published', 1), ('This', 1), ('excretion', 1), ('knowledge', 1), ('factors', 1), ('Data', 1), ('4', 1), ('production', 1), ('studies', 1), ('treatment', 1), ('health', 1), ('residual', 1), ('amounts', 1), ('overall', 1), ('', 1), ('used', 1), ('excretions', 1), ('need', 1), ('constructed', 1), ('analysis', 1), ('gross', 1), ('8', 1), ('developed', 1), ('improve', 1), ('less', 1), ('starch', 1), ('environmental', 1), ('132', 1), ('reduced', 1), ('primary', 1), ('effect', 1), ('rich', 1), ('productivity', 1), ('predicted', 1), ('ether', 1), ('describe', 1), ('food', 1), ('cost', 1), ('imposing', 1), ('develop', 1), ('proportion', 1), ('animal', 1), ('database', 1), ('burden', 1), ('intakes', 1), ('indicators', 1), ('inefficient', 1), ('regression', 1), ('consuming', 1), ('demonstrated', 1), ('highest', 1), ('effective', 1), ('essential', 1), ('substantial', 1), ('mean', 1), ('containing', 1), ('range', 1), ('error', 1), ('performed', 1), ('study', 1), ('458', 1), ('account', 1), ('1194', 1), ('rather', 1), ('Evaluation', 1), ('meat', 1), ('actual', 1), ('nutrient', 1), ('security', 1), ('100', 1), ('development', 1), ('contributing', 1), ('Beef', 1), ('either', 1), ('maximum', 1), ('high', 1), ('excreting', 1), ('207', 1), ('aim', 1), ('contain', 1), ('acid', 1), ('digestibilities', 1), ('various', 1), ('underestimated', 1), ('extent', 1), ('neutral', 1), ('main', 1), ('potential', 1), ('Regression', 1), ('557', 1), ('well', 1), ('109', 1), ('already', 1), ('best', 1), ('764', 1), ('weight', 1), ('nutritional', 1), ('extract', 1), ('accurate', 1), ('affecting', 1), ('evaluate', 1), ('displayed', 1), ('kg', 1), ('included', 1), ('Increasing', 1)]","['value', 'ash', 'More', 'likelihood', 'body', 'including', 'organic', 'Existing', 'forage', 'utilising', 'predictor', 'means', 'valuable', 'thus', 'evaluation', 'A', 'data', '69', 'occurring', 'published', 'This', 'excretion', 'knowledge', 'factors', 'Data', '4', 'production', 'studies', 'treatment', 'health', 'residual', 'amounts', 'overall', '', 'used', 'excretions', 'need', 'constructed', 'analysis', 'gross', '8', 'developed', 'improve', 'less', 'starch', 'environmental', '132', 'reduced', 'primary', 'effect', 'rich', 'productivity', 'predicted', 'ether', 'describe', 'food', 'cost', 'imposing', 'develop', 'proportion', 'animal', 'database', 'burden', 'intakes', 'indicators', 'inefficient', 'regression', 'consuming', 'demonstrated', 'highest', 'effective', 'essential', 'substantial', 'mean', 'containing', 'range', 'error', 'performed', 'study', '458', 'account', '1194', 'rather', 'Evaluation', 'meat', 'actual', 'nutrient', 'security', '100', 'development', 'contributing', 'Beef', 'either', 'maximum', 'high', 'excreting', '207', 'aim', 'contain', 'acid', 'digestibilities', 'various', 'underestimated', 'extent', 'neutral', 'main', 'potential', 'Regression', '557', 'well', '109', 'already', 'best', '764', 'weight', 'nutritional', 'extract', 'accurate', 'affecting', 'evaluate', 'displayed', 'kg', 'included', 'Increasing']","['https://sdfestaticassets-eu-west-1.sciencedirectassets.com/shared-assets/24/images/elsevier-non-solus-new-grey.svg', 'https://sdfestaticassets-us-east-1.sciencedirectassets.com/prod/74c6099c36819bfc8606dd144f68dd107c82feb0/image/elsevier-non-solus.png', 'https://ars.els-cdn.com/content/image/1-s2.0-S0167880919X00080-cov150h.gif', 'https://sdfestaticassets-eu-west-1.sciencedirectassets.com/shared-assets/26/images/wordmark-elsevier.svg']"
Health Sciences,,Evolution of soil organic carbon in a carbonaceous glacial till as an effect of crop and fertility management over 50 years in a field experiment - ScienceDirect,"['Karin', 'Kauer', 'Alar', 'Astover', 'Rein', 'Viiralt', 'Henn', 'Raave', 'Thomas', 'Kätterer']","['Long-term field experiment', 'Soil organic matter', 'SOC sequestration efficiency', 'Water-soluble carbon']",SOC sequestration greater perennial annual crops C retention lower crop residues 6 1 amendments 22 ,"[('lower', 1), ('crops', 1), ('sequestration', 1), ('residues', 1), ('perennial', 1), ('annual', 1), ('6', 1), ('C', 1), ('amendments', 1), ('retention', 1), ('22', 1), ('greater', 1), ('1', 1), ('SOC', 1), ('crop', 1), ('', 1)]","['lower', 'crops', 'sequestration', 'residues', 'perennial', 'annual', '6', 'C', 'amendments', 'retention', '22', 'greater', '1', 'SOC', 'crop', '']","['https://sdfestaticassets-eu-west-1.sciencedirectassets.com/shared-assets/24/images/elsevier-non-solus-new-grey.svg', 'https://sdfestaticassets-us-east-1.sciencedirectassets.com/prod/74c6099c36819bfc8606dd144f68dd107c82feb0/image/elsevier-non-solus.png', 'https://ars.els-cdn.com/content/image/S01678809.gif', 'https://sdfestaticassets-eu-west-1.sciencedirectassets.com/shared-assets/26/images/wordmark-elsevier.svg']"
Health Sciences,,Fertilised soil solution study using a drop distribution pattern - ScienceDirect,"['Olga', 'Chambers', 'Aleksander', 'Sešek', 'Jurij F.', 'Tasič', 'Janez', 'Trontelj']","['Fertiliser analysis', 'Soil characterisation', 'Distribution pattern', 'Soil nutrients']",Paper describes novel method soil fertilisation characterisation Fertilizer characterized using drop distribution pattern There correlation deposition pattern fertiliser concentration Potassium observable distribution pattern The paper proposes novel method characterisation fertilised soil properties based dried drop analysis The method consists solution extraction soil water mixture dry pattern formation image analysis The soil solution distribution patterns obtained pure fertilised soils indicating fertiliser impact pattern morphology The results obtained allow identification structural variations soil drop patterns correlate added fertiliser The classification results show 79 soil samples single fertiliser solution correctly classified The impact fertilisers soil textures distribution pattern morphology shown ,"[('soil', 7), ('The', 6), ('pattern', 6), ('fertiliser', 4), ('distribution', 4), ('drop', 3), ('solution', 3), ('method', 3), ('impact', 2), ('morphology', 2), ('results', 2), ('novel', 2), ('obtained', 2), ('analysis', 2), ('characterisation', 2), ('patterns', 2), ('fertilised', 2), ('observable', 1), ('added', 1), ('79', 1), ('formation', 1), ('correlate', 1), ('consists', 1), ('deposition', 1), ('dry', 1), ('correctly', 1), ('fertilisers', 1), ('mixture', 1), ('textures', 1), ('Paper', 1), ('water', 1), ('characterized', 1), ('classified', 1), ('identification', 1), ('There', 1), ('indicating', 1), ('dried', 1), ('Fertilizer', 1), ('pure', 1), ('paper', 1), ('using', 1), ('allow', 1), ('extraction', 1), ('soils', 1), ('proposes', 1), ('samples', 1), ('fertilisation', 1), ('show', 1), ('single', 1), ('variations', 1), ('image', 1), ('classification', 1), ('Potassium', 1), ('based', 1), ('correlation', 1), ('describes', 1), ('properties', 1), ('concentration', 1), ('structural', 1), ('shown', 1), ('', 1)]","['observable', 'added', '79', 'formation', 'correlate', 'consists', 'deposition', 'dry', 'correctly', 'fertilisers', 'mixture', 'textures', 'Paper', 'water', 'characterized', 'classified', 'identification', 'There', 'indicating', 'dried', 'Fertilizer', 'pure', 'paper', 'using', 'allow', 'extraction', 'soils', 'proposes', 'samples', 'fertilisation', 'show', 'single', 'variations', 'image', 'classification', 'Potassium', 'based', 'correlation', 'describes', 'properties', 'concentration', 'structural', 'shown', '']","['https://sdfestaticassets-eu-west-1.sciencedirectassets.com/shared-assets/24/images/elsevier-non-solus-new-grey.svg', 'https://sdfestaticassets-us-east-1.sciencedirectassets.com/prod/74c6099c36819bfc8606dd144f68dd107c82feb0/image/elsevier-non-solus.png', 'https://ars.els-cdn.com/content/image/S01681699.gif', 'https://sdfestaticassets-eu-west-1.sciencedirectassets.com/shared-assets/26/images/wordmark-elsevier.svg']"
