Topic,Sub-Category,Titles,Authors,Keywords,Abstract/Highlights,Frequency,Hapaxex,Images
Health Sciences,,The potential of different semi-natural habitats to sustain pollinators and natural enemies in European agricultural landscapes - ScienceDirect,"['Agustín M.', 'Bartual', 'Louis', 'Sutter', 'Gionata', 'Bocci', 'Anna-Camilla', 'Moonen', 'James', 'Cresswell', 'Martin', 'Entling', 'Brice', 'Giffard', 'Katja', 'Jacot', 'Philippe', 'Jeanneret', 'John', 'Holland', 'Sonja', 'Pfister', 'Orsolya', 'Pintér', 'Eve', 'Veromann', 'Karin', 'Winkler', 'Matthias', 'Albrecht']","['Bees', 'Biodiversity conservation', 'Conservation biological control', 'Natural enemies', 'Pollinators', 'Semi-natural habitat management', 'Agroecology', 'Integrated pest management']",Pollinators natural enemies compared across 217 semi natural habitats SNH Areal herbaceous SNH important pollinators woody edges enemies Pollinators well predicted SNH type floral abundance plant trait groups SNH type important better predict pollinators enemies agroecosystems Crucial promote agroecosystems diverse SNH complementary plant traits Semi natural habitats SNH vital sustain pollinators natural enemies ecosystem services provide agroecosystems However little known relative importance different SNH types vegetation traits pollinators natural enemies Yet knowledge essential effective habitat management promote functional arthropod groups associated multiple ecosystem services We quantified vegetation traits abundances pollinators bees natural enemies predatory flies parasitic wasps 217 SNH differing type woody herbaceous shape linear areal habitats edge interior locations within SNH patch respect adjacent crops across 62 agricultural landscapes four European countries Pollinators natural enemies responded distinctively major SNH types within habitat location SNH abundance natural enemies predatory flies parasitic wasps higher along woody habitat edges herbaceous SNH interior woody habitats In contrast bee abundances especially honey bees generally higher areal herbaceous compared woody SNH Abundances wild bees managed honey bees lowest interior sampling location areal woody habitats These findings reflected divergent key vegetation traits driving pollinator natural enemy abundances across SNH bee pollinators increased herbaceous plant cover well predicted SNH type floral abundance identified key plant trait groups In contrast floral abundances plant groups poor predictors studied natural enemies better predicted SNH type sampling location within SNH Our findings stress need move beyond simplistic pooling SNH types highlight importance considering vegetation traits reliably predict pollinators natural enemies agroecosystems They suggest floral abundance key groups flowering plants crucial habitat management promote bee pollinators vegetation structural traits appear important predatory flies parasitoids The distinct importance different SNH types associated vegetation traits pollinators natural enemies calls agroecosystem management ensuring diverse SNH complementary vegetation traits concomitantly foster pollination pest control services ,"[('SNH', 20), ('natural', 12), ('enemies', 11), ('pollinators', 9), ('traits', 8), ('vegetation', 7), ('woody', 6), ('type', 5), ('habitats', 5), ('herbaceous', 5), ('groups', 5), ('plant', 5), ('habitat', 4), ('agroecosystems', 4), ('types', 4), ('floral', 4), ('bees', 4), ('abundances', 4), ('abundance', 4), ('important', 3), ('predatory', 3), ('importance', 3), ('interior', 3), ('management', 3), ('flies', 3), ('services', 3), ('promote', 3), ('predicted', 3), ('within', 3), ('key', 3), ('areal', 3), ('bee', 3), ('location', 3), ('Pollinators', 3), ('across', 3), ('contrast', 2), ('compared', 2), ('In', 2), ('trait', 2), ('findings', 2), ('better', 2), ('complementary', 2), ('wasps', 2), ('sampling', 2), ('higher', 2), ('ecosystem', 2), ('well', 2), ('honey', 2), ('edges', 2), ('parasitic', 2), ('different', 2), ('217', 2), ('predict', 2), ('associated', 2), ('diverse', 2), ('agroecosystem', 1), ('major', 1), ('reliably', 1), ('multiple', 1), ('shape', 1), ('need', 1), ('knowledge', 1), ('reflected', 1), ('enemy', 1), ('', 1), ('responded', 1), ('countries', 1), ('These', 1), ('provide', 1), ('stress', 1), ('arthropod', 1), ('We', 1), ('wild', 1), ('identified', 1), ('semi', 1), ('poor', 1), ('Abundances', 1), ('Crucial', 1), ('ensuring', 1), ('patch', 1), ('lowest', 1), ('plants', 1), ('pooling', 1), ('managed', 1), ('adjacent', 1), ('predictors', 1), ('calls', 1), ('generally', 1), ('linear', 1), ('distinctively', 1), ('relative', 1), ('concomitantly', 1), ('four', 1), ('studied', 1), ('considering', 1), ('Areal', 1), ('respect', 1), ('suggest', 1), ('little', 1), ('They', 1), ('flowering', 1), ('agricultural', 1), ('especially', 1), ('pest', 1), ('sustain', 1), ('European', 1), ('However', 1), ('pollination', 1), ('distinct', 1), ('increased', 1), ('differing', 1), ('driving', 1), ('cover', 1), ('simplistic', 1), ('crucial', 1), ('crops', 1), ('divergent', 1), ('parasitoids', 1), ('control', 1), ('foster', 1), ('beyond', 1), ('along', 1), ('edge', 1), ('Our', 1), ('highlight', 1), ('pollinator', 1), ('Semi', 1), ('known', 1), ('structural', 1), ('locations', 1), ('vital', 1), ('effective', 1), ('The', 1), ('essential', 1), ('landscapes', 1), ('functional', 1), ('Yet', 1), ('quantified', 1), ('62', 1), ('appear', 1), ('move', 1)]","['agroecosystem', 'major', 'reliably', 'multiple', 'shape', 'need', 'knowledge', 'reflected', 'enemy', '', 'responded', 'countries', 'These', 'provide', 'stress', 'arthropod', 'We', 'wild', 'identified', 'semi', 'poor', 'Abundances', 'Crucial', 'ensuring', 'patch', 'lowest', 'plants', 'pooling', 'managed', 'adjacent', 'predictors', 'calls', 'generally', 'linear', 'distinctively', 'relative', 'concomitantly', 'four', 'studied', 'considering', 'Areal', 'respect', 'suggest', 'little', 'They', 'flowering', 'agricultural', 'especially', 'pest', 'sustain', 'European', 'However', 'pollination', 'distinct', 'increased', 'differing', 'driving', 'cover', 'simplistic', 'crucial', 'crops', 'divergent', 'parasitoids', 'control', 'foster', 'beyond', 'along', 'edge', 'Our', 'highlight', 'pollinator', 'Semi', 'known', 'structural', 'locations', 'vital', 'effective', 'The', 'essential', 'landscapes', 'functional', 'Yet', 'quantified', '62', 'appear', 'move']","['https://sdfestaticassets-eu-west-1.sciencedirectassets.com/shared-assets/24/images/elsevier-non-solus-new-grey.svg', 'https://sdfestaticassets-us-east-1.sciencedirectassets.com/prod/74c6099c36819bfc8606dd144f68dd107c82feb0/image/elsevier-non-solus.png', 'https://ars.els-cdn.com/content/image/1-s2.0-S0167880919X00079-cov150h.gif', 'https://sdfestaticassets-eu-west-1.sciencedirectassets.com/shared-assets/26/images/wordmark-elsevier.svg']"
Health Sciences,,The role of mitochondria-derived peptides in cardiovascular disease: Recent updates - ScienceDirect,"['Yingxi', 'Yang', 'Huijuan', 'Gao', 'Huan', 'Zhou', 'Qi', 'Liu', 'Zhongwen', 'Qi', 'Ying', 'Zhang', 'Junping', 'Zhang']","['Cardiovascular disease', 'Mitochondria-derived peptides', 'Humanin', 'MOTS-c']",Mitochondria derived peptides MDPs series peptides encoded mitochondrial DNA similar functions mitochondria At present three types MDPs found including Humanin MOTS c SHLP1 6 They new metabolic regulators human body play cytoprotective role maintaining mitochondrial function cell viability pressure Increasingly researchers demonstrated MDPs proved effects cell survival metabolism response stressors inflammation vivo vitro Recently advance research shown MDPs significant effects development cardiovascular diseases CVD In review cover relationships MDPs cardiovascular risk factors myocardial ischemia reperfusion injury myocardial fibrosis coronary microcirculatory dysfunction also possible pathogenic mechanisms MDPs considered novel biomarkers therapeutic targets CVD ,"[('MDPs', 6), ('cardiovascular', 2), ('CVD', 2), ('myocardial', 2), ('peptides', 2), ('effects', 2), ('cell', 2), ('mitochondrial', 2), ('microcirculatory', 1), ('human', 1), ('stressors', 1), ('research', 1), ('In', 1), ('types', 1), ('therapeutic', 1), ('advance', 1), ('metabolism', 1), ('metabolic', 1), ('DNA', 1), ('vitro', 1), ('dysfunction', 1), ('review', 1), ('possible', 1), ('vivo', 1), ('Recently', 1), ('reperfusion', 1), ('shown', 1), ('survival', 1), ('c', 1), ('present', 1), ('coronary', 1), ('demonstrated', 1), ('researchers', 1), ('injury', 1), ('development', 1), ('SHLP1', 1), ('ischemia', 1), ('functions', 1), ('similar', 1), ('cytoprotective', 1), ('biomarkers', 1), ('targets', 1), ('new', 1), ('significant', 1), ('also', 1), ('series', 1), ('found', 1), ('relationships', 1), ('function', 1), ('mitochondria', 1), ('diseases', 1), ('body', 1), ('fibrosis', 1), ('novel', 1), ('maintaining', 1), ('considered', 1), ('play', 1), ('risk', 1), ('role', 1), ('mechanisms', 1), ('MOTS', 1), ('Mitochondria', 1), ('cover', 1), ('At', 1), ('inflammation', 1), ('viability', 1), ('pathogenic', 1), ('regulators', 1), ('proved', 1), ('including', 1), ('encoded', 1), ('derived', 1), ('pressure', 1), ('three', 1), ('factors', 1), ('6', 1), ('Humanin', 1), ('Increasingly', 1), ('response', 1), ('They', 1), ('', 1)]","['microcirculatory', 'human', 'stressors', 'research', 'In', 'types', 'therapeutic', 'advance', 'metabolism', 'metabolic', 'DNA', 'vitro', 'dysfunction', 'review', 'possible', 'vivo', 'Recently', 'reperfusion', 'shown', 'survival', 'c', 'present', 'coronary', 'demonstrated', 'researchers', 'injury', 'development', 'SHLP1', 'ischemia', 'functions', 'similar', 'cytoprotective', 'biomarkers', 'targets', 'new', 'significant', 'also', 'series', 'found', 'relationships', 'function', 'mitochondria', 'diseases', 'body', 'fibrosis', 'novel', 'maintaining', 'considered', 'play', 'risk', 'role', 'mechanisms', 'MOTS', 'Mitochondria', 'cover', 'At', 'inflammation', 'viability', 'pathogenic', 'regulators', 'proved', 'including', 'encoded', 'derived', 'pressure', 'three', 'factors', '6', 'Humanin', 'Increasingly', 'response', 'They', '']","['https://sdfestaticassets-eu-west-1.sciencedirectassets.com/shared-assets/24/images/elsevier-non-solus-new-grey.svg', 'https://sdfestaticassets-us-east-1.sciencedirectassets.com/prod/74c6099c36819bfc8606dd144f68dd107c82feb0/image/elsevier-non-solus.png', 'https://ars.els-cdn.com/content/image/S07533322.gif', 'https://sdfestaticassets-eu-west-1.sciencedirectassets.com/shared-assets/26/images/wordmark-elsevier.svg']"
Health Sciences,,Vision-based monitoring of orchards with UAVs - ScienceDirect,"['Nikolaos', 'Stefas', 'Haluk', 'Bayram', 'Volkan', 'Isler']","['Vision-based navigation', 'Unmanned aerial vehicles', 'Agricultural robotics', 'Dynamic obstacle avoidance']",An aerial robotic system pre harvest monitoring orchards Fully autonomous safe row navigation Complete visual coverage yield We present autonomous aerial system safely navigate inside rows orchard crop inspection yield estimation similar farm management tasks Our operating environment two practical constraints GPS signal unreliable close ground trees grow large branches might block robot predetermined path To address challenges developed components navigation vision based obstacle detection avoidance path planning visual coverage Results field demonstration apple orchard presented showcasing ability system perform successful navigation complete yield coverage apple tree rows ,"[('coverage', 3), ('system', 3), ('navigation', 3), ('yield', 3), ('visual', 2), ('aerial', 2), ('orchard', 2), ('autonomous', 2), ('path', 2), ('rows', 2), ('apple', 2), ('tasks', 1), ('To', 1), ('successful', 1), ('obstacle', 1), ('monitoring', 1), ('large', 1), ('pre', 1), ('crop', 1), ('ability', 1), ('constraints', 1), ('planning', 1), ('inspection', 1), ('developed', 1), ('Our', 1), ('address', 1), ('inside', 1), ('practical', 1), ('navigate', 1), ('We', 1), ('detection', 1), ('components', 1), ('signal', 1), ('farm', 1), ('similar', 1), ('harvest', 1), ('ground', 1), ('might', 1), ('demonstration', 1), ('safe', 1), ('Complete', 1), ('robot', 1), ('two', 1), ('estimation', 1), ('management', 1), ('branches', 1), ('tree', 1), ('vision', 1), ('close', 1), ('perform', 1), ('showcasing', 1), ('robotic', 1), ('GPS', 1), ('unreliable', 1), ('block', 1), ('trees', 1), ('Results', 1), ('present', 1), ('safely', 1), ('environment', 1), ('operating', 1), ('An', 1), ('presented', 1), ('challenges', 1), ('row', 1), ('grow', 1), ('avoidance', 1), ('complete', 1), ('predetermined', 1), ('Fully', 1), ('field', 1), ('orchards', 1), ('based', 1), ('', 1)]","['tasks', 'To', 'successful', 'obstacle', 'monitoring', 'large', 'pre', 'crop', 'ability', 'constraints', 'planning', 'inspection', 'developed', 'Our', 'address', 'inside', 'practical', 'navigate', 'We', 'detection', 'components', 'signal', 'farm', 'similar', 'harvest', 'ground', 'might', 'demonstration', 'safe', 'Complete', 'robot', 'two', 'estimation', 'management', 'branches', 'tree', 'vision', 'close', 'perform', 'showcasing', 'robotic', 'GPS', 'unreliable', 'block', 'trees', 'Results', 'present', 'safely', 'environment', 'operating', 'An', 'presented', 'challenges', 'row', 'grow', 'avoidance', 'complete', 'predetermined', 'Fully', 'field', 'orchards', 'based', '']","['https://sdfestaticassets-eu-west-1.sciencedirectassets.com/shared-assets/24/images/elsevier-non-solus-new-grey.svg', 'https://sdfestaticassets-us-east-1.sciencedirectassets.com/prod/74c6099c36819bfc8606dd144f68dd107c82feb0/image/elsevier-non-solus.png', 'https://ars.els-cdn.com/content/image/S01681699.gif', 'https://sdfestaticassets-eu-west-1.sciencedirectassets.com/shared-assets/26/images/wordmark-elsevier.svg']"
Health Sciences,,Adult balanoposthitis patients have a higher risk of type 2 diabetes mellitus: A nationwide population-based cohort study - ScienceDirect,"['Chi-Shun', 'Lien', 'Sheng-Wei', 'Lee', 'Chao-Hsiang', 'Chang', 'Chi-Jung', 'Chung', 'Cheng-Li', 'Lin', 'Chi-Ping', 'Huang']","['Balanoposthitis', 'Type 2 diabetes mellitus', 'Retrospective cohort study', None, 'type 2 diabetes mellitus', None, 'coronary artery disease', None, 'chronic kidney disease', None, 'Longitudinal Health Insurance Database 2000']",We investigated association balanoposthitis risk type 2 diabetes mellitus type 2 DM retrospective cohort study From Longitudinal Health Insurance Database LHID 2000 selected male patients aged 20 years first diagnosed balanoposthitis 2000 2010 Men without balanoposthitis also included analysis frequency matching age index year All participants followed diagnosis type 2 DM Diseases coded accordance International Classification Diseases Ninth Revision Clinical Modification ICD 9 CM Baseline comorbidity history subject determined LHID dataset A multivariable Cox proportional hazard regression model established Kaplan Meier survival curve plotted The incidence type 2 DM higher balanoposthitis cohort non balanoposthitis cohort 14 8 vs 5 42 per 1000 person years hazard ratio 2 55 95 CI 2 22 2 92 adjusting age comorbidities The incidence type 2 DM increased age cohorts Balanitis patients hypertension hyperlipidemia obesity higher risks type 2 DM without conditions p 0 05 Men balanoposthitis may higher risk type 2 DM future Therefore clinical physicians pay attention early evaluation management type 2 DM patients balanoposthitis ,"[('2', 11), ('type', 8), ('balanoposthitis', 7), ('DM', 7), ('higher', 3), ('age', 3), ('cohort', 3), ('patients', 3), ('Diseases', 2), ('without', 2), ('risk', 2), ('LHID', 2), ('incidence', 2), ('years', 2), ('Men', 2), ('2000', 2), ('hazard', 2), ('The', 2), ('Balanitis', 1), ('risks', 1), ('hyperlipidemia', 1), ('20', 1), ('clinical', 1), ('hypertension', 1), ('evaluation', 1), ('history', 1), ('Insurance', 1), ('attention', 1), ('14', 1), ('05', 1), ('55', 1), ('42', 1), ('coded', 1), ('All', 1), ('pay', 1), ('Classification', 1), ('may', 1), ('year', 1), ('Revision', 1), ('regression', 1), ('physicians', 1), ('survival', 1), ('1000', 1), ('per', 1), ('Therefore', 1), ('2010', 1), ('22', 1), ('Cox', 1), ('8', 1), ('person', 1), ('We', 1), ('first', 1), ('multivariable', 1), ('also', 1), ('comorbidity', 1), ('Clinical', 1), ('Modification', 1), ('International', 1), ('plotted', 1), ('accordance', 1), ('From', 1), ('Ninth', 1), ('non', 1), ('male', 1), ('dataset', 1), ('management', 1), ('CI', 1), ('Health', 1), ('Kaplan', 1), ('comorbidities', 1), ('adjusting', 1), ('retrospective', 1), ('A', 1), ('curve', 1), ('cohorts', 1), ('CM', 1), ('diagnosis', 1), ('p', 1), ('matching', 1), ('index', 1), ('0', 1), ('5', 1), ('frequency', 1), ('Database', 1), ('selected', 1), ('increased', 1), ('Longitudinal', 1), ('association', 1), ('Meier', 1), ('9', 1), ('participants', 1), ('model', 1), ('established', 1), ('determined', 1), ('obesity', 1), ('Baseline', 1), ('aged', 1), ('95', 1), ('diagnosed', 1), ('diabetes', 1), ('future', 1), ('early', 1), ('subject', 1), ('study', 1), ('included', 1), ('92', 1), ('ICD', 1), ('ratio', 1), ('analysis', 1), ('followed', 1), ('investigated', 1), ('conditions', 1), ('mellitus', 1), ('proportional', 1), ('vs', 1), ('', 1)]","['Balanitis', 'risks', 'hyperlipidemia', '20', 'clinical', 'hypertension', 'evaluation', 'history', 'Insurance', 'attention', '14', '05', '55', '42', 'coded', 'All', 'pay', 'Classification', 'may', 'year', 'Revision', 'regression', 'physicians', 'survival', '1000', 'per', 'Therefore', '2010', '22', 'Cox', '8', 'person', 'We', 'first', 'multivariable', 'also', 'comorbidity', 'Clinical', 'Modification', 'International', 'plotted', 'accordance', 'From', 'Ninth', 'non', 'male', 'dataset', 'management', 'CI', 'Health', 'Kaplan', 'comorbidities', 'adjusting', 'retrospective', 'A', 'curve', 'cohorts', 'CM', 'diagnosis', 'p', 'matching', 'index', '0', '5', 'frequency', 'Database', 'selected', 'increased', 'Longitudinal', 'association', 'Meier', '9', 'participants', 'model', 'established', 'determined', 'obesity', 'Baseline', 'aged', '95', 'diagnosed', 'diabetes', 'future', 'early', 'subject', 'study', 'included', '92', 'ICD', 'ratio', 'analysis', 'followed', 'investigated', 'conditions', 'mellitus', 'proportional', 'vs', '']","['https://sdfestaticassets-eu-west-1.sciencedirectassets.com/shared-assets/24/images/elsevier-non-solus-new-grey.svg', 'https://ars.els-cdn.com/content/image/D18795226.gif', 'https://ars.els-cdn.com/content/image/S18795226.gif', 'https://sdfestaticassets-eu-west-1.sciencedirectassets.com/shared-assets/26/images/wordmark-elsevier.svg']"
Health Sciences,,Comparative analysis between radical cystectomy and trimodality therapy for clinical stage II bladder cancer – Experience from a tertiary referral center - ScienceDirect,"['Jian-Hua', 'Hong', 'Yu-Hua', 'Lin', 'Yu-Chuan', 'Lu', 'Yun', 'Chiang', 'Huai-Ching', 'Tai', 'Kuo-How', 'Huang', 'Chia-Hsien', 'Cheng', 'Yeong-Shiau', 'Pu']","['Bladder cancer', 'Urothelial carcinoma', 'Cystectomy', 'Diabetes mellitus', 'Trimodality therapy', 'Hydronephrosis']",To analyze clinicopathologic characteristics oncologic outcomes radical cystectomy RC trimodality therapy TMT patients clinical stage II bladder urothelial carcinoma UC Between January 2004 September 2013 medical records 93 consecutive patients clinical stage II bladder cancer cT2N0M0 diagnosed National Taiwan University Hospital retrospectively reviewed including 66 RC 27 TMT Univariate multivariate Cox regression analyses performed determine prognostic factors The median follow time 34 1 months Significant differences TMT RC groups respect age gender cancer grade presence hydronephrosis noted The 5 year overall survival rate 74 5 year cancer specific survival rate 76 showed comparable results RC TMT groups The overall recurrence rate 38 RC 41 vs TMT 30 p 0 35 The presence hydronephrosis demonstrated statistically significant association tumor recurrence HR 2 03 95 CI 1 03 4 00 p 0 04 Diabetes mellitus DM patients independently correlated poorer overall survival HR 2 74 95 CI 1 09 6 83 p 0 03 cancer specific survival HR 3 32 95 CI 1 28 8 69 p 0 01 TMT optimal therapeutic option selected patients clinical stage II bladder UC In study despite method treatment presence hydronephrosis increased risk cancer recurrence DM demonstrated significantly negative effect overall survival cancer specific survival ,"[('cancer', 6), ('survival', 6), ('TMT', 6), ('RC', 5), ('The', 4), ('overall', 4), ('p', 4), ('0', 4), ('patients', 4), ('1', 4), ('03', 3), ('II', 3), ('hydronephrosis', 3), ('rate', 3), ('clinical', 3), ('95', 3), ('presence', 3), ('stage', 3), ('specific', 3), ('bladder', 3), ('CI', 3), ('HR', 3), ('recurrence', 3), ('year', 2), ('74', 2), ('5', 2), ('2', 2), ('demonstrated', 2), ('UC', 2), ('groups', 2), ('DM', 2), ('2004', 1), ('poorer', 1), ('prognostic', 1), ('increased', 1), ('multivariate', 1), ('6', 1), ('therapeutic', 1), ('oncologic', 1), ('consecutive', 1), ('records', 1), ('69', 1), ('To', 1), ('analyze', 1), ('statistically', 1), ('time', 1), ('Univariate', 1), ('independently', 1), ('cT2N0M0', 1), ('significantly', 1), ('significant', 1), ('analyses', 1), ('Cox', 1), ('median', 1), ('association', 1), ('characteristics', 1), ('2013', 1), ('Significant', 1), ('regression', 1), ('comparable', 1), ('effect', 1), ('therapy', 1), ('30', 1), ('vs', 1), ('correlated', 1), ('January', 1), ('outcomes', 1), ('treatment', 1), ('reviewed', 1), ('35', 1), ('respect', 1), ('retrospectively', 1), ('Hospital', 1), ('differences', 1), ('study', 1), ('01', 1), ('risk', 1), ('04', 1), ('negative', 1), ('Taiwan', 1), ('32', 1), ('follow', 1), ('carcinoma', 1), ('tumor', 1), ('option', 1), ('41', 1), ('months', 1), ('4', 1), ('despite', 1), ('factors', 1), ('83', 1), ('Diabetes', 1), ('76', 1), ('selected', 1), ('performed', 1), ('93', 1), ('28', 1), ('method', 1), ('diagnosed', 1), ('noted', 1), ('clinicopathologic', 1), ('Between', 1), ('including', 1), ('age', 1), ('grade', 1), ('27', 1), ('38', 1), ('cystectomy', 1), ('09', 1), ('optimal', 1), ('34', 1), ('In', 1), ('8', 1), ('radical', 1), ('medical', 1), ('urothelial', 1), ('mellitus', 1), ('September', 1), ('results', 1), ('gender', 1), ('University', 1), ('determine', 1), ('3', 1), ('trimodality', 1), ('66', 1), ('National', 1), ('showed', 1), ('00', 1), ('', 1)]","['2004', 'poorer', 'prognostic', 'increased', 'multivariate', '6', 'therapeutic', 'oncologic', 'consecutive', 'records', '69', 'To', 'analyze', 'statistically', 'time', 'Univariate', 'independently', 'cT2N0M0', 'significantly', 'significant', 'analyses', 'Cox', 'median', 'association', 'characteristics', '2013', 'Significant', 'regression', 'comparable', 'effect', 'therapy', '30', 'vs', 'correlated', 'January', 'outcomes', 'treatment', 'reviewed', '35', 'respect', 'retrospectively', 'Hospital', 'differences', 'study', '01', 'risk', '04', 'negative', 'Taiwan', '32', 'follow', 'carcinoma', 'tumor', 'option', '41', 'months', '4', 'despite', 'factors', '83', 'Diabetes', '76', 'selected', 'performed', '93', '28', 'method', 'diagnosed', 'noted', 'clinicopathologic', 'Between', 'including', 'age', 'grade', '27', '38', 'cystectomy', '09', 'optimal', '34', 'In', '8', 'radical', 'medical', 'urothelial', 'mellitus', 'September', 'results', 'gender', 'University', 'determine', '3', 'trimodality', '66', 'National', 'showed', '00', '']","['https://sdfestaticassets-eu-west-1.sciencedirectassets.com/shared-assets/24/images/elsevier-non-solus-new-grey.svg', 'https://ars.els-cdn.com/content/image/D18795226.gif', 'https://ars.els-cdn.com/content/image/S18795226.gif', 'https://sdfestaticassets-eu-west-1.sciencedirectassets.com/shared-assets/26/images/wordmark-elsevier.svg']"
